slug,SKU,MPN,GTIN,consum_top,consum_bottom,consum_seo_title,consum_seo_meta_keywords,consum_seo_meta_description,consum_seo_og_title,consum_seo_og_locale,consum_seo_og_image,consum_seo_og_image_secure_url,consum_seo_og_image_width,consum_seo_og_image_height,consum_seo_og_image_alt,consum_seo_og_description,consum_seo_og_site_name,consum_seo_og_type,consum_seo_og_url,consum_seo_fb_app_id,consum_seo_twitter_card,consum_seo_twitter_site,consum_seo_twitter_image,consum_seo_twitter_image_alt,consum_seo_twitter_title,consum_seo_twitter_description,consum_seo_twitter_url,consum_jsonld_description,disponibil_din_data,is_package
sapa-epoxidica-egalizare,EMX-091-NS-6-20GR,PCK609120GR,5941930706622,"<div class=""descript_par""><p><span class=""alineat_span""></span><strong><em>Sapa de Egalizare Epoxy-Cimentica &ldquo;Emex Mineral&rdquo;</em></strong> reprezinta una dintre solutiile ideale pentru remedierea pardoselilor cu grad mare de degradare, la costuri scazute, cu rezultate excelente si cu maxim de performanta.<br><span class=""alineat_span""></span>Asigura perfecta egalizare si planeitate a suprafetelor denivelate, concomitent cu umplerea fisurilor sau golurilor din suport, si este recomandata, in special, pentru pregatirea suprafetelor inainte de acoperirea cu pardoseli sau vopsitorii epoxidice, poliuretanice, poliesterice, sau chiar MMA, cu care prezinta compatibilitate totala.<br><span class=""alineat_span""></span>Este un sistem profesional, <em class=""green-mark"">fara emisii de COV sau mirosuri</em>, dintr-o baza aminica emulsionata aditivata, o rasina epoxidica nesolventata, cu adaos de materiale dure ca ciment si cuart, ce asigura reduceri semnificative de cost.<br><span class=""alineat_span""></span><em class=""green-mark"">Un aspect important, este ca permite aplicarea pe suporturi cu umiditate ridicata, de peste 45&#37;</em>.<br><span class=""alineat_span""></span>Asigura rezistenta si stabilitate mare in medii agresive chimic, acide sau alcaline, durabilitate, rezistenta la socuri mecanice sau termice, la temperaturi extreme, pozitive sau negative, sau variatii mari de temperatura.<br><span class=""alineat_span""></span>Asigura pregatirea primara a pardoselilor din beton in vederea aplicarii de pardoseli sintetice. Acest sistem este cea mai buna varianta de restaurare a suprafetei, in ceea ce priveste atat duritatea si rezistenta, cat si pretul, foarte accesibil comparativ cu alte metode conventionale, cum ar fi frezarea suportului.<br><span class=""alineat_span""></span>Indiferent de tipul stratului final, epoxidic, poluretanic, poliesteric sau MMA, gradul de compatibilitate este maxim. <strong><em>Sapa epoxidica autonivelanta de egalizare</em></strong> este folosita cu rezultate excelente pe toate pardoselile din beton avariate sau ce necesita o pregatire preliminara pentru planeitate, dar poate fi folosita si pentru cai de acces in panta, supuse unei exploatari foarte intense.</p></div>",,Consum Sapa Egalizare Epoxidica Tricomponenta,"consum sapa epoxidica de egalizare, calcul beton epoxidic",Calcul de Consum ? Sapa Epoxy-Cimentica de Egalizare. Produs tricomponent pentru egalizarea suporturilor de beton ? Ideal pentru Pardoseli Industriale,? Calcul de Consum Sapa Epoxy-Cimentica,ro_RO,https://emex.ro/images/social/Sapa-epoxi-cimentica-de-egalizare-sm.jpg,https://emex.ro/images/social/Sapa-epoxi-cimentica-de-egalizare-sm.jpg,1200,628,Consum sapa epoxy tricomponenta,Calculul consumului de Sapa Epoxy-Cimentica pentru egalizarea si remedierea defectelor suporturilor de beton inaintea aplicarii de pardoseli sintetice,Emex by Romtehnochim: vopsele | tencuieli | pardoseli,Product,https://emex.ro/consum-sapa-epoxidica,966242223397117,summary_large_image,@Romtehnochim,https://emex.ro/images/social/Sapa-epoxi-cimentica-de-egalizare-sm.jpg,Calcul sapa tricomponenta epoxidica,? Calcul Consum Sapa Tricomponenta Epoxy,Produs tricomponent de mare performanta pentru repararea egalizarea si planeizarea suporturilor deteriorate,https://emex.ro/consum-sapa-epoxidica,"Calcul Consum pentru ? Sapa Tricomponenta Epoxy-Cimentica de Egalizare ? Sistem Epoxidic Profesional de Mare Performanta, cu Adaos de Ciment si Cuartz, pentru Egalizarea si Planeizarea Suporturilor Deteriorate, cu Defecte sau Imbatranite ? 0724-509.552 - Calitate la Pret de Producator !",,1
pardoseala-epoxidica-decorativa-cuartz,EMX-084-NS-6-27MM,CVR608427MM,5941930706639,"<div class=""descript_par""><p><span class=""alineat_span""></span><strong><em>Covorul Epoxidic Decorativ cu Cuartz ""Emex Quartz""</em></strong> este un <em class=""green-mark"">sistem tricomponent profesional, cu o <strong>duritate remarcabila</strong> si aspect mozaicat, de performanta avansata, mult superior sistemelor conventionale de pardoseala</em>, mai ales in ceea ce priveste duritatea si durata de viata.<br><span class=""alineat_span""></span>Este alcatuit din rasina epoxidica solvent-free, intaritor si granule de cuartz in diverse combinatii de culoare. <em class=""mark"">Aplicarea se va face de personal specializat in utilizarea rasinilor bicomponente si, preferabil, cu utilaje dedicate</em>.<br><span class=""alineat_span""></span>Este destinat realizarii de pardoseli de inalta calitate, cu rezistente speciale si de durata, dar si cu un aspect decorativ de exceptie, conferit de granulele colorate de cuartz, distribuite in masa produsului si elicopterizate, pana la obtinerea unei suprafete stabile, dure si perfect lise. Lisarea se poate efectua si manual, respectand cantitatile mentionate in <a href=""/doc/pardoseala-epoxidica-decorativa-cuartz-STB.pdf"" title=""Fisa tehnica covor epoxidic de cuartz""><em class=""link_color1"">Fisa Tehnica</em></a>, caz in care <em class=""green-mark"">se poate realiza si ca sistem antiderapant</em>.<br><span class=""alineat_span""></span>Acest <strong><em>“covor epoxidic de cuartz”</em></strong> inlocuieste cu succes mozaicul sau gresia, prezentand avantajul unui aspect decorativ de mai mare efect, dar si de o duritate si stabilitate superioare, cu o rezistenta extinsa la utilizare. Are caracteristici de baza remarcabile, ca buna rezistenta la factori chimic agresivi, rezistenta la socuri mecanice sau variatii termice, rezistenta la uzura, trafic si exploatare intense, duritate exceptionala, etc.<br><span class=""alineat_span""></span>Se remarca si prin <strong class=""green-mark""><em>durata de viata min. 10 ani</em></strong>, in conditiile unei exploatari fara agresiuni majore, de orice natura, sau defecte progresive ale suportului, ca fisuri, infiltratii, macinare datorata betonului de slaba calitate, etc.<br><span class=""alineat_span""></span>Culoarea pardoselii epoxidice realizate, va fi determinata de culorile particulelor de cuartz alese.</p></div>",NULL,Consum covor epoxidic de cuartz,"calcul covor epoxidic cuartz, consum pardoseala STB, calcul pardoseala decorativa","Calcul de Consum pentru ? Covor Epoxidic Decorativ de Cuartz ? Pardoseli Industriale cu Cuart de Mare Duritate, cu Rezistenta la Socuri Mecanice !",? Consum pardoseala epoxidica cu cuartz,ro_RO,https://emex.ro/images/social/Pardoseala-epoxidica-decorativa-sm.png,https://emex.ro/images/social/Pardoseala-epoxidica-decorativa-sm.png,1200,628,Consum pentru covor epoxidic de cuartz,Calcul de consum pentru pardoseala epoxidica stb sau covor epoxidic de cuartz. Sistem avansat de mare rezistenta pentru protectia pardoselilor ,Emex by Romtehnochim: vopsele | tencuieli | pardoseli,Product,consum-pardoseala-epoxidica-cuart,966242223397117,summary_large_image,@Romtehnochim,https://emex.ro/images/social/Pardoseala-epoxidica-decorativa-sm.png,Consum pardoseala epoxidica decorativa cu cuartz,? Consum covor decorativ epoxidic,Calcul de consum pentru pardoseala epoxidica stb sau covor epoxidic de cuartz. Sistem epoxidic de mare performanta,consum-pardoseala-epoxidica-cuart,"Calcul de Consum pentru? Pardoseala Epoxidica STB sau Covor Epoxidic de Cuartz ? Sistem Avansat de Protectie a Pardoselilor Industriale sau Rezidentiale, de Mare Rezistenta, Performanta si Duritate Maxima. Cel mai Performant din Gama ? 0724-509.552 - Calitate la Pret de Producator !",,1
pardoseala-epoxidica-multicolor,EMX-085-NS-6-20AB,PCK608520AB,5941930706646,"<div class=""descript_par""><p><span class=""alineat_span""></span><strong><em>Pardoseala Epoxidica Bicomponenta &ldquo;Emex Multicolor&rdquo;</em></strong> are aceleasi caracteristici de performanta ca si <a href=""/pardoseala-epoxidica"" title=""Pardoseala epoxidica autonivelanta divers colorata""><em class=""link_color1"">Pardoseala Autonivelanta Epoxidica &ldquo;Emex&rdquo;</em></a>, dar cu aspect diferit, datorita utilizarii de plachete decorative (chipsuri, lamele sau fulgi), divers colorate pe suprafata cruda de pardoseala. <em class=""green-mark"">Combinatiile de culoare sunt realizate atat din turnare, cat si din distribuirea acestor elemente decorative</em>. Rezultatul este un aspect decorativ placut, care este, totodata, ideal si pentru suporturi intens circulate, estompand defectele de turnare a betonului si protejand cu succes suprafetele, impotriva factorilor de uzura.<br><span class=""alineat_span""></span>Aspectul superior, conferit de combinatiile de culoare si de distribuirea microplachetelor pe suprafata, permite folosirea acestei pardoseli epoxidice in toate zonele comerciale care necesita o prezentare deosebita, cum ar fi show-room-uri sau cai de acces interioare, dar si in spatii casnice cum ar fi living-uri sau alte spatii expuse.<br><span class=""alineat_span""></span><strong class=""subs-attn attn-text"">Atentie</strong>: Avand in vedere caracteristicile in stare lichida, cum ar fi <em class=""mark""><strong>pot-life-ul foarte scurt, de cca 20 minute</strong>, conditiile speciale de pregatire a suportului astfel incat sa nu existe contaminanti, iar umiditatea sa fie in limitele admise, aplicarea se va face de personal specializat, cu experienta in domeniul pardoselilor bicomponente</em>.<br><span class=""alineat_span""></span>Aplicarea pardoselii se va face prin turnare, intindere cu tragatoare specializate si dezaerare cu role cu ace. Chipsurile decorative colorate vor fi dispersate pe suprafata proaspata. Dupa uscare se va lacui intreaga suprafata, atat pentru fixarea plachetelor, cat si pentru realizarea unui aspect estetic superior. In cazul, putin probabil, in care se constata o vascozitate ridicata, datorita temperaturii sau a depozitarii, <em class=""mark"">pentru reglarea vascozitatii se pot folosi doar solventi specializati &ldquo;Emex&rdquo;, numai sub indrumarea producatorului si conform recomandarilor acestuia</em>.</p></div>",NULL,Consum Pardoseala Epoxidica cu Fulgi Metalizati,"consum epoxidica decorativa, calcul epoxidica multicolor","Calculul Consumului pentru ? Pardoseala Epoxidica Decorativa Bicomponenta Solvent-Free, cu ? Plachete Decorative, Chipsuri, Lamele sau Fulgi Colorati",? Consum pardoseala epoxidica multicolor,ro_RO,https://emex.ro/images/social/Pardoseala-multicolor-sm.jpg,https://emex.ro/images/social/Pardoseala-multicolor-sm.jpg,1200,628,Consum pardoseala decorativa cu fulgi metalizati,Calcul de consum - Autonivelanta cu efect decorativ din rasina epoxidica solvent-free cu fulgi metalizati colorati. Utilizata si in zone circulate,Emex by Romtehnochim: vopsele | tencuieli | pardoseli,Product,https://emex.ro/consum-pardoseala-epoxidica-multicolor,966242223397117,summary_large_image,@Romtehnochim,https://emex.ro/images/social/Pardoseala-multicolor-sm.jpg,Consum pardoseala epoxidica cu fulgi metalizati,,Calculul consumului de rasina epoxidica solvent-free si fulgi metalizati colorati - pardoseala decorativa,https://emex.ro/consum-pardoseala-epoxidica-multicolor,"Calculul Consumului de ? Pardoseala Epoxidica Decorativa “Emex Multicolor” cu Plachete Decorative, Chipsuri, Lamele sau Fulgi Colorati ? Produs Profesional cu Performanta Excelenta, Aspect Superior, Rezistenta, Duritate, Durabilitate ? 0724-509.552 - Calitate Superioara la Pret de Producator !",,NULL
amorsa-impregnare-pardoseli-epoxidice,EMX-008-S-6-4AE,PCK608804AE,5941930706738,"<div class=""descript_par""><p><span class=""alineat_span""></span><strong><em>Amorsa Epoxidica Nesolventata de Impregnare &#8220;Emex&#8221;</em></strong> are o utilizare profesionala, in scopul de a crea o compatibilitate maxima la nivelul suprafetei, in vederea acoperirii cu vopsele sau pardoseli epoxidice ori poliuretanice. Acest produs ajuta la pregatirea suprafetei, atat prin sigilarea porilor din suport cat si prin fixarea de profunzime, care va stabiliza suprafata, chiar in situatia in care betonul este deteriorat, sau de calitate inferioara.<br><span class=""alineat_span""></span>Se foloseste pentru pardoseli din beton, sapa cimentica, piatra sau orice alt material mineral, dupa efectuarea prealabila de teste. Caracteristicile amorsei vor amplifica perfomantele generale, in special proprietatile de duritate, rezistenta la socuri mecanice sau la factori agresivi ori variatii de temperatura, ale pardoselii aplicate.</p><p class=""text-center""><em>Datorita faptului ca este folosita in sistem cu pardoselile (si/ sau vopselele) bicomponente epoxidice sau poliuretanice, si Amorsa Epoxidica Nesolventata &#8220;Emex&#8221; este agrementata sanitar, pentru folosirea in spatii cu cerinte superioare de igiena, obiective de prelucrare sau desfacere alimente, ori cu destinatie medicala.</em></p><p><span class=""alineat_span""></span>Operatiunile de pregatire a suprafetei-suport, ca factor determinant in obtinerea performantelor maxime ale produsului, trebuie sa respecte un minim de etape, din care enumeram:</p><ul class=""lista-links""><li>Curatarea preliminara, prin procedee mecanice, de resturi, fragmente si deseuri ce au aderat la suprafata, din diverse operatiuni anterioare (tencuiri, gletuiri, vopsiri, etc.).</li><li>Degresarea, care trebuie sa asigure eliminarea, in cat mai mare profunzime, a contaminantilor amprentati in suport, ca hidrocarburi, grasimi si uleiuri, murdarie, etc. Suportul va fi uscat la aplicare</li><li>Asperizarea, pentru obtinerea de puncte de ancora, neceare unei perfecte aderente. In functie de necesitati, aceasta se face fie prin sablare, fie prin prelucrare cu discuri diamantate ori cutite.</li><li>Orice acoperire anterioara va fi inlaturata. Suportul va fi dur, uscat, compact, fara risc de exfoliere.</li></ul><p><span class=""alineat_span""></span><strong><em>Amorsa Epoxidica de Impregnare &#8220;Emex&#8221;</em></strong> se va aplica numai prin roluire, cu trafaleti destinati special acestei operatiuni, de rezistenta superioara. Corectarea vascozitatii, in cazul in care este absolut necesara, se poate face numai cu solventi specializati &#8220;Emex&#8221;, <span class=""subs-attn"">la recomandarea producatorului si cu respectarea instructiunilor de aplicare</span>.</p><p><span class=""alineat_span""></span>Pentru obtinerea de performante maxime va rugam sa cititi cu atentie si sa respectati Instructiunile de Aplicare descrise in <a href=""/doc/amorsa-epoxidica-solvent-free.pdf"" title=""Fisa tehnica grund epoxidic amorsare pardoseli""><strong class=""link_color1""><em>Fisa Tehnica</em></strong></a>, in special pregatirea suprafetelor.</p></div>",NULL,,,,,,,,,,,,,,,,,,,,,,,,,0
amorsa-poliuretanica-nesolventata-pardoseli,EMX-012-NS-6-4GP,PCK601204GP,5941930706752,"<div class=""descript_par""><p><span class=""alineat_span""></span><strong><em>Amorsa Poliuretanica Solvent-Free &ldquo;Emex HS100&rdquo;</em></strong> pentru <em>pardoseli poliuretanice</em>, este destinata utilizarii ca strat primar, pentru realizarea unei bune sigilari a porilor betonului si <em class=""green-mark"">asigurarea unei compatibilitati optime intre suportul cimentic si pardoseala poliuretanica finala</em>. Desi este recomandata paentru pardoselile poliuretanice high-solid, poate fi utilizata cu succes si pentru vopsirea cu vopsele poliuretanice de pardoseala.<br><span class=""alineat_span""></span><em class=""mark"">Sistemul este unul profesional, si se va aplica numai de personal specializat si cu experienta in utilizarea rasinilor bicomponente</em>.<br><span class=""alineat_span""></span>Sistemul de <em>amorsare poliuretanica</em> prezentat mai sus, <em class=""green-mark"">realizeaza o compatibilitate perfecta intre pardoseala din beton si stratul de rasina poliuretanica turnata</em> (sau vopsea poliuretanica de pardoseala), intrunind, in acelasi, timp caracteristici superioare de performanta, care se manifesta prin rezistenta mare la factori chimici, corozivi sau de mediu, la variatii de temperatura, dar si durabilitate, duritate, stabilitate, etc.<br><span class=""alineat_span""></span>Cu toate ca <em>necesita o aplicare profesionala</em> si pretentioasa, folosirea acestui grund de amorsare este justificata datorita performantelor avansate, realizate in pregatirea eficienta a suporturilor cimentice, pentru care asigura o protectie superioara la agenti chimici, socuri mecanice sau termice, variatii de temperatura, etc., consolidand in acelasi timp caracteristicile de performanta ale <em>pardoselii poliuretanice</em>, cum ar fi rezistenta si stabilitatea in timp.<br><span class=""alineat_span""></span>Aplicarea ulterioara a sistemului de <strong><em>pardoseala poliuretanica</em></strong> se va executa intre 12 si 20 de are de la amorsare, prin intinderea cu tragatoare cu dinti, reglate pentru grosimea dorita, urmata de dezaerare. In mod similar, <strong><em>Vopseaua Poliuretanica de Pardoseala</em></strong> se va aplica in acelasi interval de timp, prin modalitatile cunoscute.<br><span class=""alineat_span""></span><em class=""mark"">Produsul nu se va dilua</em>.</p></div>",NULL,Calcul de Consum Amorsa Poliuretanica Solvent-Free,"consum amorsa poliuretanica solvent-free, calcul amorsa poliuretanica nesolventata",Calcul de Consum ? Amorsa Poliuretanica Nesolventata “Emex HS100” ? Produs Profesional pentru Fixare Suport si Aplicare de Pardoseli Poliuretanice.,? Consum amorsa poliuretanica fara solvent,ro_RO,https://emex.ro/images/social/Amorsa-poliuretanica-nesolventata-sm.jpg,https://emex.ro/images/social/Amorsa-poliuretanica-nesolventata-sm.jpg,1200,628,Amorsa nesolventa poliuretanica pentru pardoseala,Calcul de consum amorsa poliuretanica solvent-free pentru pardoseli din beton. Sigileaza si pregateste betonul pentru aplicare pardoseli poliuretanice,Emex by Romtehnochim: vopsele | tencuieli | pardoseli,Product,https://emex.ro/consum-amorsa-poliuretanica-solvent-free,966242223397117,summary_large_image,@Romtehnochim,https://emex.ro/images/social/Amorsa-poliuretanica-nesolventata-sm.jpg,Amorsa solvent-free poliuretanica pentru beton,? Calcul amorsa poliuretanica solvent-free,Consum amorsa poliuretanica solvent-free “Emex HS100”. sistem profesional de sigilare pori si fixare suport,https://emex.ro/consum-amorsa-poliuretanica-solvent-free,"Calcul de consum ? Amorsa Poliuretanica Solvent-Free “Emex HS100” ? Sistem Primar cu Aderenta si Rezistenta Ridicata la Factori Agresivi Mecanici, Chimici sau de Mediu, pentru Impregnare Beton, Sigilare Pori si Fixare Suport ? 0724-509.552 - Calitate Superioara la Pret de Producator !",,0
intaritor-rasini-epoxidice-nesolventate,EMX-050-S-6-2IE,INT605002IE,5941930706776,"<div class=""descript_par""><p><span class=""alineat_span""></span><strong><em>Intaritorul Epoxidic &#8220;Emex&#8221; Seria I 30-30</em></strong> este folosit ca agent de polimerizare pentru produsele realizate din rasini epoxidice nesolventate, din gama &#8220;Emex&#8221;, ca <em>Pardoseala sau Vopseaua Epoxidica</em>, dar si produsele conexe.<br><span class=""alineat_span""></span>Bineinteles, utilizarea intaritorului este in directa corepondenta cu prosusul final, caruia ii va conferi toate performantele optime, aria de utilizare fiind cea a produsului de baza. Mentionam, totusi, ca zonele de utilizare sunt preponderent cele de pardoseala din beton, mozaic, sapa, alte materiale cimentice, unde, in combinatie cu rasina, poate realiza diverse acoperiri cu aspect decorativ superior, dar si de mare rezistenta.<br><span class=""alineat_span""></span>Se foloseste cu precadere in industria alimentara, chimica, farmaceutica, de prelucrare a titeiului, industria hartiei, industria navala, de armament, dar si in toate zonele unde este solicitata o rezistenta ridicata la factori chimici, mecanici, sau medii agresive (factori chimici, umiditate mare, uleiuri, trafic intens, etc.), ori conditii speciale de igiena (laboratoare medicale, farmacii, servicii de alimentatie publica, etc.).</p><p class=""text-center""><em><strong>Intaritorul epoxidic &#8220;Emex I 30-30&#8221;</strong>, este folosit in sisteme agrementate sanitar, si este recomandat in zonele cu cerinte maxime de igiena si protectie sanitara, ca: alimentatia publica, restaurante, cantine, industria medicamentelor, laboratoare, spitale, farmacii, indeplinind cu succes toate cerintele normelor europene.</em></p><p><span class=""alineat_span""></span>Este obligatorie respectarea tuturor indicatiilor, sau limitarilor din Fisa Tehnica a produsului de baza, in vederea obtinerii performantelor maxime finale. <em class=""subs-attn mark"">Este un produs profesional pentru utilizare cu personal specializat</em>.<br><span class=""alineat_span""></span>Rapoartele de amestecare sunt prezentate in documentatia fiecarui produs in parte, ele diferind atat in functie de tipul de sistem, temperatura si conditiile de aplicare, cat si de tipul de material din care este alcatuit suportul. Aceste rapoarte sunt gravimetrice, deci <em class=""subs-attn"">va fi absolut necesara cantarirea componentilor</em>. Dozarea volumetrica prezinta riscul aparitiei de erori semnificative, datorita diferentelor de densitate existente intre loturi.</p><p><span class=""alineat_span""></span>Este recomandat pentru suprafetele interioare. Pentru suporturi situate la exterior sunt necesari aditivi speciali, ce vor fi adaugati doar industrial, de catre producator, numai la comanda.</p><p><span class=""alineat_span""></span>Pentru obtinerea de performante maxime va rugam sa cititi cu atentie si sa respectati Instructiunile de Aplicare descrise in <a href=""/doc/intaritor-rasini-epoxidice-nesolventate.pdf"" title=""Fisa tehnica intaritor epoxidic solvent-free""><strong class=""link_color1""><em>Fisa Tehnica</em></strong></a>, in special pregatirea suprafetelor.</p></div>",NULL,,,,,,,,,,,,,,,,,,,,,,,,NULL,NULL
intaritor-rasini-poliuretanice-nesolventate,EMX-052-S-6-2IP,INT605202IP,5941930706790,"<div class=""descript_par""><p><span class=""alineat_span""></span><strong><em>Intaritorul Poliuretanic &#8220;Emex 2K-PA&#8221;</em></strong> este folosit ca agent de polimerizare doar in combinatie cu polioli acrilici solvent-free, folositi la fabricarea de produse poliuretanice din gama &#8220;Emex&#8221;, ca: vopsele poliuretanice de pardoseala solvent-free, pardoseli poliuretanice de orice tip, lacuri si membrane poliuretanice, doar din rasini nesolventate.</p><p class=""text-center""><em class=""subs-attn attn-text"">Acest tip de intaritor NU poate fi folosit pentru lacuri, vopsele, grunduri sau emailuri poliuretanice solventate</em>.</p><p><span class=""alineat_span""></span>Utilizarea intaritorului se gaseste in stricta corelatie cu produsul final, pentru care va asigura performante de sistem. Suporturile compatibile sunt cele atribuite si sistemului (vopsea sau pardoseala poliuretanica, etc.), si putem mentiona: beton, sape cimentice, mozaicuri, pardoseli exploatate in industria alimentara, chimica, farmaceutica, de prelucrare a titeiului, industria hartiei, de armament, alte zone unde este solicitata o rezistenta ridicata la factori chimici, mecanici, sau medii agresive (umiditate mare, uleiuri, trafic, etc.), ori conditii speciale de igiena ca: laboratoare medicale, farmacii servicii de alimentatie publica, etc., dar si alte suporturi minerale.</p><p class=""text-center""><em><strong>Intaritorul poliuretanic &#8220;Emex 2K-PA&#8221;</strong> beneficiaza de agrement sanitar, eliberat pentru sistemul poliuretanic final, care poate fi aplicat in toate zonele cu cerinte speciale de igiena, ca: zone de protectie sanitara, spitale, laboratoare, farmacii, unitati de alimentatie publica sau procesare alimente, etc., conform cerintelor europene de igiena.</em></p><p><span class=""alineat_span""></span>Pentru realizarea parametrilor optimi si performantelor maxime ale sistemului folosit, se vor respecta in mod strict atat indicatiile cat si limitarile prezentate in Fisa Tehnica a produsului de baza.<br><span class=""alineat_span""></span>Se va avea in vedere in special faptul ca rapoartele de amestecare, prezentate si in documentatia fiecarui produs, sunt gravimetrice, deci, <em class=""subs-attn mark"">in mod obligatoriu, se va proceda la cantarire</em>. Datorita posibilelor diferente de densitate dintre loturi, dozarea volumetrica genereaza erori procentuale mari, care pot determina polimerizarea incompleta, sau chiar compromiterea sistemului. Aceste rapoarte sunt influentate, de asemenea, de sistem si temperatura.</p><p><span class=""alineat_span""></span>Performantele acestui intaritor sunt similare atat la interior, cat si la exterior, produsul prezentand o rezistenta mare, atat la lumina cat si la intemperii, lucrand sinergic, impreuna cu baza, pentru realizarea parametrilor optimi.</p><p><span class=""alineat_span""></span>Pentru obtinerea de performante maxime va rugam sa cititi cu atentie si sa respectati Instructiunile de Aplicare descrise in <a href=""/doc/intaritor-rasini-poliuretanice-nesolventate.pdf"" title=""Fisa tehnica intaritor poliuretanice nesolventate""><strong class=""link_color1""><em>Fisa Tehnica</em></strong></a>, in special pregatirea suprafetelor.</p></div>",NULL,,,,,,,,,,,,,,,,,,,,,,,,,0
