slug,SKU,MPN,GTIN,consum_top,consum_bottom,consum_seo_title,consum_seo_meta_keywords,consum_seo_meta_description,consum_seo_og_title,consum_seo_og_locale,consum_seo_og_image,consum_seo_og_image_secure_url,consum_seo_og_image_width,consum_seo_og_image_height,consum_seo_og_image_alt,consum_seo_og_description,consum_seo_og_site_name,consum_seo_og_type,consum_seo_og_url,consum_seo_fb_app_id,consum_seo_twitter_card,consum_seo_twitter_site,consum_seo_twitter_image,consum_seo_twitter_image_alt,consum_seo_twitter_title,consum_seo_twitter_description,consum_seo_twitter_url,consum_jsonld_description,disponibil_din_data,is_package
grund-epoxidic-monocomponent-epoxi-ester,EMX-137-NS-9-6RO,GRD913706RO,5941930708770,"<div class=""descript_par""><p><span class=""alineat_span""></span><strong><em>Grund Anticoroziv Epoxi-Ester &ldquo;Emex&rdquo;</em></strong> - <em class=""green-mark"">produs de generatie noua, pe baza de rasini alchidice modificate cu grupari epoxidice in esteri</em>, monocomponent, pentru utilizare generala, folosit pentru protectia suporturilor metalice, situate la interior sau la exterior, expuse la agenti corozivi, chimici sau datorati mediului, in special in industrie. In compozitia acestui grund anticoroziv se regasesc <em class=""green-mark"">inhibitori de coroziune, si agenti anticorozivi de ultima generatie, fara saruri de plumb sau crom</em>, fara impact asupra mediului.<br><span class=""alineat_span""></span>Desi utilizat, in special, pe suprafete metalice feroase, datorita aderentei avansate, similara cu cea a grundurilor bicomponente, produsul se poate utiliza si pe aluminiu sau tabla zincata (ex: acoperis), atat noua cat si veche, si <em class=""green-mark"">are rezistenta la temperaturi de pana la 200&deg;C</em>.<br><span class=""alineat_span""></span><em class=""mark"">Datorita confuziilor posibile, precizam ca <strong>acest produs nu este epoxidic bicomponent, iar proprietatile, desi superioare, nu sunt identice</strong></em>.<br><span class=""alineat_span""></span>O pregatire corecta a suportului, inaintea aplicarii, va asigura, atat pentru materialele feroase cat si pentru cele neferoase, ca <em>aluminiu sau tabla galvanizata</em>, de regula urmata de aplicarea unui <a href=""/vopsea-epoxidica-monocomponenta-epoxi-ester"" title=""Vopsea epoxidica monocomponenta""><em class=""link_color1"">Email Epoxi-Ester &ldquo;Emex Esine&rdquo;</em></a>, cu care o excelenta compatibilitate, o maxima aderenta si capacitate de protectie fata de agenti corozivi.<br><span class=""alineat_span""></span>Cu toate ca este un produs profesional, recomandat cu precadere pentru mediul industrial, nu prezinta dificultati de aplicare, si nu necesita o pregatire speciala a personalului, astfel incat <em class=""green-mark"">poate fi utilizat cu succes si in sfera casnica, DIY</em>.<br><span class=""alineat_span""></span>Performantele, similare produselor fabricate din rasina epoxidica bicomponenta, recomanda acest grund pentru metal la folosirea ca strat primar, pentru protectia suprafetelor exploatate in medii agresive, expuse la intemperii sau umiditate, sau la alti factori generatori de coroziune.</p></div>",NULL,Calcul Consum Grund Anticoroziv Epoxy-Ester,"consum grund tabla zincata, consum grund inhibitor coroziune",Calcul Consum ? Grund Anticoroziv pe Baza de Rasina Alchidica Modificata cu Grupari Epoxidice ? Rezistenta si Protectie Maxima la Coroziune !,? Consum grund monocomponent epoxy-ester,ro_RO,https://emex.ro/images/social/Grund-epoxidic-monocomponent-epoxy-ester-sm.jpg,https://emex.ro/images/social/Grund-epoxidic-monocomponent-epoxy-ester-sm.jpg,1200,628,Calcul consum grund epoxy-ester,"Grund anticoroziv din rasina modificata cu grupari epoxidice, monocomponent, cu rezistenta la apa si capacitate de protectie impotriva ruginii.",Emex by Romtehnochim: vopsele | tencuieli | pardoseli,Product,https://emex.ro/consum-grund-anticoroziv-epoxi-ester,966242223397117,summary_large_image,@Romtehnochim,https://emex.ro/images/social/Grund-epoxidic-monocomponent-epoxy-ester-sm.jpg,Grund alchidic modificat cu epoxy in ester,? Consum grund epoxy-ester monocomponent,"Calculul consumului de grund anticoroziv din rasina alchidica modificata cu grupari epoxidice, monocomponent",https://emex.ro/consum-grund-anticoroziv-epoxi-ester,"Calcul de Consum ? Grund Epoxy-Ester Produs Profesional Anticoroziv, Monocomponent ? Protectie Avansata de Generatie Noua, pentru Metal, Fonta, Aluminiu, Tabla Zincata, etc. Are Aderenta Mare, Rezistenta la Intemperii si Agenti de Coroziune ? 0724-509.552 - Calitate la Pret de Producator !",,NULL
grund-auto-utilaje,EMX-036-S-9-6RO,GRD903606RO,5941930708831,"<div class=""descript_par""><p><span class=""alineat_span""></span><strong><em>Grund Anticoroziv Auto si Utilaje &ldquo;Emex&rdquo;</em></strong> - produs monocomponent, cu uscare la aer. Este fabricat <em class=""green-mark"">pe baza de rasini alchidice slabe si rasini melaminice</em>, pasta de bronz aluminiu, pigmenti si aditivi specifici, cu un <em class=""green-mark"">adaos ridicat de materiale anticorozive si inhibitori de coroziune</em>, fara saruri de plumb sau crom, si fara alti compusi care ar putea avea un impact negativ asupra mediului.<br><span class=""alineat_span""></span>Acest <strong><em>grund anticoroziv</em></strong>, de calitate avansata, este caracterizat prin capacitate ridicata de protectie fata de actiunea factorilor generatori de coroziune, aderenta ridicata la suporturi metalice, buna rezistenta la diversi factori agresivi, chimici sau de mediu, si stabilitate in timp. Este folosit la protejarea primara a suprafetelor metalice ale caroseriilor auto sau subansamblelor de utilaje, fara a se limita la acestea, inaintea vopsirii acestora cu vopsele de utilaje sau similare, ca: <a href=""/vopsea-metal-alchido-stirenica"" title=""Vopsea pentru metal de inalta calitate""><em class=""link_color1"">Email alchido-stirenic metal &ldquo;Emex EQS&rdquo;</em></a>, ori <a href=""/vopsea-uretanizata-metal-exterior"" title=""Email superior pentru metal""><em class=""link_color1"">Email Alchidic Uretanizat &ldquo;Emex Code&rdquo;</em></a>.<br><span class=""alineat_span""></span>Este folosit ca strat primar pentru protectia anticoroziva atat a elementelor de caroserie si componente auto, cat si a utilajelor ca macarale, poduri, stivuitoare, etc., inaintea acoperirii cu vopsele dedicate.<br><span class=""alineat_span""></span>Daca se constata existenta ruginii, vechi sau doar incipiente, este necesara tratarea cu <a href=""/solutie-anti-rugina"" title=""Solutie de fosfatare impotriva ruginii""><em class=""link_color1"">Solutia de Fosfatare Antirugina &ldquo;Emex Rust Stop&rdquo;</em></a>, pentru indepartarea totala a acesteia, urmata de uscare.<br><span class=""alineat_span""></span>Atat corectia vascozitatii, cat si curatarea instrumentelor, se va face cu <a href=""/diluant-vopsele-utilaje"" title=""Solvent vopsele si emailuri auto utilaje""><em class=""link_color1"">Diluant pentru Vopsele Auto &ldquo;Emex&rdquo;</em></a>.<br><span class=""alineat_span""></span>Poate fi folosit pe orice alte suprafete metalice: tevi, conducte, containere, calorifere, tabla, schelete si rastele metalice, grilaje, parapeti, mobilier metalic, suporti metalici de fixare, garduri, porti, feronerie, stalpi metalici, standuri si copertine metalice, etc.</p></div>",NULL,Calcul Consum Grund Auto-Utilaje,"consum grund auto, calcul anticoroziv utilaje, protectie anticoroziva",Calcul de Consum ? Grund Anticoroziv pentru Caroserii Auto si Utilaje ? pentru Protectia de Utilaje si Caroserii Auto Impotriva Ruginii,? Consum Grund Anticoroziv pentru Utilaje,ro_RO,https://emex.ro/images/social/Grund-anticoroziv-auto-utilaje-sm.jpg,https://emex.ro/images/social/Grund-anticoroziv-auto-utilaje-sm.jpg,1200,628,Consum grund auto-utilaje,Calcul de consum pentru grund anticoroziv tip auto cu materiale anticorozive si inhibitori de coroziune rezistent la factori generatori de coroziune,Emex by Romtehnochim: vopsele | tencuieli | pardoseli,Product,https://emex.ro/consum-grund-auto-utilaje,966242223397117,summary_large_image,@Romtehnochim,https://emex.ro/images/social/Grund-anticoroziv-auto-utilaje-sm.jpg,Calcul de consum grund auto,? Calcul Grund Anticoroziv Auto si Utilaje,Calcul de consum grund anticoroziv auto si utilaje - cu materiale anticorozive si inhibitori de coroziune,https://emex.ro/consum-grund-auto-utilaje,"Calcul de Consum ? Grund Anticoroziv pentru Caroserii Auto si Utilaje ? cu Materiale Anticorozive si Inhibitori de Coroziune, pentru Protectia de Utilaje si Caroserii Auto. Asigura Protectie Ridicata Fata de Factori Agresivi, Generatori de Coroziune ? 0724-509.552 - Calitate la Pret de Producator !",,0
grund-alchidic-anticoroziv,EMX-034-S-2-6RO,GRD203406RO,5941930702211,"<div class=""descript_par""><p><span class=""alineat_span""></span><strong><em>Grund de Protectie Anticoroziva Metal &ldquo;Emex&rdquo;</em></strong> este un produs superior pentru protectie impotriva ruginii, fabricat din rasini alchidice, <em class=""green-mark"">agenti anticorozivi si inhibitori de coroziune, fara saruri nocive, sau impact asupra mediului</em>, pasta de bronz aluminiu, pigmenti si aditivi, cu rolul de a proteja, ca strat primar, suprafete metalice de orice tip, situate suprateran, atat la interior cat si la exterior, si expuse unor factori, chimici sau de mediu, de agresivitate medie.<br><span class=""alineat_span""></span>Acest <em>grund anticoroziv</em> are caracteristici superioare de protectie, stabilitate in timp, si rezistente specifice foarte bune, cum ar fi rezistenta la intemperii, la factori chimici moderat agresivi, variatii de temperatura, etc.<br><span class=""alineat_span""></span>Este indicat pentru orice suprafata metalica, si putem enumera, fara sa ne limitam la acestea: tevi, conducte, containere, calorifere, tabla, schelete si rastele metalice, grilaje, parapeti, mobilier metalic, suporti metalici de fixare, garduri, balustrade, porti, feronerie, stalpi metalici, scene, grinzi, standuri si copertine metalice, etc., insa <em class=""mark"">nu se va folosi la suprafete neferoase, gen inox, cupru sau aluminiu</em>, pentru care nu are compatibilitate.<br><span class=""alineat_span""></span>Inainte de aplicare, recomandarea este ca <em class=""green-mark"">suprafata sa fie sablata, pana la luciu metalic</em>. Procedeul are, suplimentar, si avantajul de a realiza o aderenta mare a grundului la suport, dar si prelungirea durabilitatii peliculei.<br><span class=""alineat_span""></span>Aplicarea acestui grund alchidic, de protectie anticoroziva, se poate face prin orice metoda, fie pensulare sau roluire, fie prin metode moderne de pulverizare cu aer, sau chiar airless. Diluarea, corectiile de vascozitate, sau curatarea petelor accidentale, se vor face cu <a href=""/diluant-alchidic"" title=""Diluant pentru grund anticoroziv""><em class=""link_color1"">Diluant Alchidic &ldquo;Emex&rdquo;</em></a>, in procentajele recomandate.<br><span class=""alineat_span""></span>Nuantele in care se fabrica sunt gri, rosu, galben. Exista posibilitati de colorare la cerere.</p></div>",NULL,Consum Grund de Protectie Anticoroziva Metal,"consum grund protectie anticoroziva, calcul grund pentru metal",Calcul de Consum pentru ? Grund Anticoroziv Alchidic Rezistent La Intemperii si Factori Chimici ? Protectie Anticoroziva Metal impotriva Ruginii,? Consum Grund Anticoroziv de Protectie Metal,ro_RO,https://emex.ro/images/social/Grund-anticoroziv-alchidic-sm.jpg,https://emex.ro/images/social/Grund-anticoroziv-alchidic-sm.jpg,1200,628,Consum grund alchidic anticoroziv,"Calcul de consum grund alchidic pentru protectia avansata impotriva ruginii a suporturilor metalice, cu rezistenta excelenta la factori de coroziune",Emex by Romtehnochim: vopsele | tencuieli | pardoseli,Product,https://emex.ro/consum-grund-alchidic-anticoroziv,966242223397117,summary_large_image,@Romtehnochim,https://emex.ro/images/social/Grund-anticoroziv-alchidic-sm.jpg,Calcul grund alchidic impotriva ruginii,? Calcul Grund Alchidic Anti-rugina Metal ,Calcul consum grund alchidic - Protectia suprafetelor metalice impotriva factorilor generatori de coroziune,https://emex.ro/consum-grund-alchidic-anticoroziv,"Calculul Consumului de ? Grund Anticoroziv Alchidic cu Pigmenti Anticorozivi si Inhibitori de Coroziune ? Produs de Calitate Superioara pentru Protectia Suprafetelor Metalice Impotriva Ruginii, la Suporturi Expuse la Intemperii sau Agenti Chimici ? 0724-509.552 - Calitate la Pret de Producator !",,NULL
grund-anticoroziv-alchido-stirenic,EMX-047-NS-9-5RO,GRD904705RO,5941930708893,"<div class=""descript_par""><p><span class=""alineat_span""></span><strong><em>Grund Anticoroziv Alchido Stirenic &ldquo;Emex&rdquo;</em></strong> - produs de noua generatie, fabricat pe baza de rasina alchidica modificata in stiren, <em class=""green-mark"">monocomponent, profesional, utilizat pentru protectia suporturilor din metal</em>, situate la interior sau la exterior, expuse la agenti corozivi, chimici sau de mediu. In formularea acestui grund anticoroziv se regasesc inhibitori de coroziune, si agenti de protectie anticoroziva de ultima generatie, lipsiti de saruri de plumb sau crom.<br><span class=""alineat_span""></span>Utilizat ca <strong><em>protectie anticoroziva</em></strong> pentru suprafete din metal sau tabla, este caracterizat prin rezistenta ridicata fata de actiunea factorilor generatori de coroziune, aderenta ridicata la suporturi metalice, buna rezistenta la diversi factori agresivi, la hidrocarburi si variatii de temperatura, dar si stabilitate in timp.<br><span class=""alineat_span""></span><em class=""green-mark"">Asigura o buna protectie anticoroziva a elementelor de constructii din otel amplasate in medii cu clasa de corozivitate pana la C3</em>.<br><span class=""alineat_span""></span>Avand performante avansate de protectie anticoroziva, este utilizat ca <em class=""green-mark"">primer pentru protectia suporturilor metalice exploatate in medii ponderat agresive, expuse la intemperii, umiditate, sau factori corozivi</em>.<br><span class=""alineat_span""></span>Poate fi aplicat prin pensulare ori roluire, sau prin pulverizare cu aer sau airless. Reglarea vascozitatii se face cu <a href=""/diluant-vopsele-utilaje"" title=""Diluant pentru grund alchido-stirenic""><em class=""link_color1"">Solvent pentru Vopsele Speciale &ldquo;Emex&rdquo;</em></a>, sau alti diluanti similari.<br><span class=""alineat_span""></span>Se foloseste la protectia anticoroziva a utilajelor si echipamentelor metalice, a masinilor agricole sau mijloacelor de transport si remorcare ca automobile, autobuze, tramvaie, tractoare, vagoane, remorci, peridoc-uri, etc., dar si in industria navala la tancuri de balast, punti interioare sau exterioare, instalatii din compartimentul masinilor, magazii frigorifice, motoare principale, opera moarta, suprastructura, etc.</p></div>",NULL,Consum Grund Anticoroziv de Protectie Metal,"calcul grund metal, consum grund alchidic stiren, consum anticoroziv",Calcul de Consum ? Grund Anticoroziv Alchido-Stirenic ? Actiune Intensa de Inhibare a Ruginii pentru Suporturile Metalice Expuse la Factori Corozivi !,? Calcul grund protectie anticoroziva,ro_RO,https://emex.ro/images/social/Grund-anticoroziv-metal-alchido-stirenic-sm.jpg,https://emex.ro/images/social/Grund-anticoroziv-metal-alchido-stirenic-sm.jpg,1200,628,Consum grund alchido-stirenic anticoroziv,"Grund anticoroziv alchido-stirenic de noua generatie cu rezistenta avansata la agresiuni chimice moderate, pentru suporturi si echipamente metalice",Emex by Romtehnochim: vopsele | tencuieli | pardoseli,Product,https://emex.ro/consum-grund-anticoroziv-alchido-stirenic,966242223397117,summary_large_image,@Romtehnochim,https://emex.ro/images/social/Grund-anticoroziv-metal-alchido-stirenic-sm.jpg,Calcul grund anticoroziv de inalta calitate,? Consum grund pentru protectie metal,"Consum grund alchido-stirenic cu rezistenta avansata la agresiuni, intemperii, expunere la umezeala sau coroziune",https://emex.ro/consum-grund-anticoroziv-alchido-stirenic,"Calcul de Consum ? Grund Anticoroziv Alchido-Stirenic de Noua Generatie ? Proprietati Avansate de Protectie si Rezistenta la Agresiuni Chimice Moderate, Intemperii, Expunere la Umezeala sau Coroziune, pentru Suporturi si Echipamente Metalice ? 0724-509.552 - Calitate la Pret de Producator !",,0
grund-alchido-melaminic-cuptor,EMX-030-NS-9-6RO,GRD903006RO,5941930708954,"<div class=""descript_par""><p><span class=""alineat_span""></span><strong><em>Grund Anticoroziv cu Uscare la Cuptor &#8220;Emex&#8221;</em></strong> este un produs de inalta calite, de utilizare primara, de mare eficienta pentru acoperirile anticorozive speciale, destinate unor zone de intensa expunere la factori chimici sau de mediu. Este utilizat pe orice suprafata metalica, ce solicita o protectie superioara si o calitate speciala a vopsirii. Este folosit pe orice suprafata metalica, ce solicita o protectie superioara, o duritate ridicata, impreuna cu o durabilitate mare, dar si o calitate speciala a acoperirii. Desi este destinat pentru uscarea la cuptor, se poate usca si la aer, in conditii normale de temperatura, dar intr-un timp mai indelungat, si realizand parametri mai scazuti de duritate.<br><span class=""alineat_span""></span>Este folosit, in special, pentru elemente metalice expuse permanent la intemperii sau medii agresive, dar si in industria producatore de masini unelte, auto, sau chiar navala, datorita parametrilor de calitate ridicati.<br><span class=""alineat_span""></span>Produsul, este necesar a fi folosit doar dupa pregatirea suportului pe care va fi aplicat, in modul cel mai corect.<br><span class=""alineat_span""></span>Dupa stare, putem sa evidentiem doua tipuri de suprafete:</p><strong>Suprafete noi:</strong><ul class=""lista-front""><li>Necesita doar indepartarea uleiurilor ramase din fabricatie, printr-o degresare optima.</li></ul><strong>Suporturi anterior protejate:</strong><ul class=""lista-front""><li>Acestea necesita o curatare intensa, de regula prin sablare pana la luciu metalic. Sablarea este cel mai eficient procedeu folosit la inlaturarea peliculelor vechi, si prezinta avantajul ca va mari si aderenta grundului la suport.</li><li>Se pot folosi si alte metode, cum ar fi cele de periere mecanica sau decapare chimica prin folosirea de compusi chimici specifici, ca <a href=""/decapant-vopsea-lemn-metal"" title=""Decapant pentru curatare vopsea veche""><em class=""link_color1"">Pasta pentru Decapare &#8220;Emex CM Cleaner&#8221;</em></a>, sau <a href=""/decapant-ecologic-vopsele"" title=""Decapant ecologic pentru curatare vopsea""><em class=""link_color1"">Pasta Decapanta &#8220;Emex PC ECO&#8221;</em></a>, dar daca nu sunt suficiente, si nu este atins luciul metalic, atunci se impune totusi sablarea conform instructiunilor.</li></ul><p><span class=""alineat_span""></span>Pentru cazurile in care se constata prezenta de urme vechi de rugina, se recomanda tratarea cu <a href=""/solutie-anti-rugina"" title=""Solutie de fosfatare impotriva ruginii""><em class=""link_color1"">Solutie de Indepartare a Ruginii &#8220;Emex Rust Stop&#8221;</em></a> sau, ca mijloc alternativ, <a href=""/convertor-rugina"" title=""Convertor anticoroziune pentru fixarea ruginii""><em class=""link_color1"">Convertor de Rugina &#8220;Emex Oxifer&#8221;</em></a>, care va fixa rugina pe suportul metalic, printr-o actiune de chelare si, o va inactiva, prevenind reaparitia acesteia.<br><span class=""alineat_span""></span>Aplicarea grundului de cuptor se face doar prin pulverizare cu aer sau airless. Atat diluarea, cat si curatarea petelor accidentale, sau a instrumentelor de lucru, se va face cu <a href=""/diluant-vopsele-utilaje"" title=""Solvent vopsele si emailuri clorcauciuc""><em class=""link_color1"">Diluant pentru Vopsele Auto &#8220;Emex&#8221;</em></a>.</p><p><span class=""alineat_span""></span>Produsul este recomandat prioritar pentru zone expuse corodarii agresive, caroseriilor si pieselor auto sau de utilaje, dar poate fi folosit pe orice alte suprafete metalice: tevi, conducte, containere, calorifere, tabla, schelete si rastele metalice, grilaje, parapeti, mobilier metalic, suporti metalici de fixare, balustrade, porti, feronerie, standuri si copertine metalice, stalpi metalici, scene, in general pentru zone ce nesita o puternica protectie anticoroziva.</p><ul><li>Este indicat la protejarea suporturilor metalice supraterane.</li><li>Nu se recomanda pentru aluminiu, alama, cupru, tabla zincata sau inox.</li></ul><p><span class=""alineat_span""></span><strong><em>Grundul Anticoroziv Alchido-Melaminic &#8220;Emex&#8221;</em></strong> poate fi folosit cu rezultate excelente in sistem cu <a href=""/vopsea-utilaje"" title=""Emailul alchidic tip auto""><em class=""link_color1"">Emailul tip Auto pentru Utilaje &#8220;Emex&#8221;</em></a>, sau alte emailuri ce suporta, sau sunt recomandate pentru uscare la cuptor.</p><p><span class=""alineat_span""></span>Pentru obtinerea de performante maxime va rugam sa cititi cu atentie si sa respectati Instructiunile de Aplicare descrise in <a href=""/doc/grund-alchido-melaminic-cuptor.pdf"" title=""Fisa tehnica grund anticoroziv de cuptor""><strong class=""link_color1""><em>Fisa Tehnica</em></strong></a>, in special pregatirea suprafetelor.</p></div>",NULL,,,,,,,,,,,,,,,,,,,,,,,,,NULL
grund-termorezistent-siliconic,EMX-045-NS-9-5NG,GRD904505NG,5941930708992,"<div class=""descript_par""><p><span class=""alineat_span""></span><strong><em>Grund Termorezistent Siliconic &ldquo;Emex HTP&rdquo;</em></strong> - este un alt <em class=""mark"">produs de utilizare strict profesionala</em>, nu datorita dificultatii de aplicare, cat datorita necesitatii respectarii stricte a intructiunilor de aplicare. Este monocomponent si, desi uscarea superficiala are loc prin reticulare oxidativa la aer, <em class=""mark"">uscarea in profunzime si indeplinirea parametrior de rezistenta vor avea loc numai sub actiunea temperaturilor ridicate, de minim 230&deg;C</em>. Aplicarea sa este optionala.<br><span class=""alineat_span""></span>Este fabricat pe baza de rasini siliconice, aditivi specifici, si pigmenti cu rezistenta la temperaturi inalte. Este singurul grund anticoroziv care <em class=""green-mark"">isi poate pastra toate caracterisiticile superioare, la temperaturi de pana la 400&deg;C</em>.<br><span class=""alineat_span""></span>Cerintele privind respectarea conditiilor de aplicare, obliga la o intrebuintare supusa unei rigori, <em class=""mark"">sub o supraveghere stricta, si aplicare asigurata de personal specializat, cu experienta</em>.<br><span class=""alineat_span""></span>Performantele maxime produsului, pentru elemente metalice, de otel sau fonta, expuse continuu sau temporar la <em class=""green-mark"">temperaturi ridicate, de pana la 400&deg;C</em>, sunt realizate doar dupa uscarea la o temperatura de circa 230&deg;C, si nu pot fi optim atinse, decat prin respectarea instructiunilor de aplicare, majoritatea prevazute in Fisa Tehnica.<br><span class=""alineat_span""></span>Suporturile, pentru care produsul este in mod special recomandat, sunt suprafetele de otel si fonta, expuse la temperaturi ridicate ca: reactoare, cuptoare industriale, etuve, sobe si calorifere de fonta, tevi de esapament ori alte elemente de evacuare a gazelor, utilaje industriale, pompe, conducte, cuptoare, furnale, s.a.<br><span class=""alineat_span""></span>Pentru o aplicare corecta, este necesara sablarea pana la luciu metalic, recunoscuta ca fiind cel mai eficient procedeu de curatare, ce prezinta si avantajul ca va mari si aderenta la suport, prin crearea de puncte de ancora.</p></div>",,Calcul Consum Grund Anticoroziv Siliconic,"consum grund anticoroziv termorezistent, calcul grund rezistent la temperatura",Calcul de Consum ? Grund Anticoroziv Termorezistent Siliconic - Contine Inhibitori de Coroziune ? Rezistenta la Temperaturi Ridicate si Rugina,? Consum Grund Termorezistent Siliconic,ro_RO,https://emex.ro/images/social/Grund-rezistent-la-temperatura-SM.jpg,https://emex.ro/images/social/Grund-rezistent-la-temperatura-SM.jpg,1200,628,Calcul de consum grund termorezistent,Calcul de consum Grund Termorezistent Anticoroziv cu la 400&deg;C fabricat din rasini siliconice si compusi rezistenti la temperatura si coroziune,Emex by Romtehnochim: vopsele | tencuieli | pardoseli,Product,https://emex.ro/consum-grund-termorezistent-anticoroziv,966242223397117,summary_large_image,@Romtehnochim,https://emex.ro/images/social/Grund-rezistent-la-temperatura-SM.jpg,Calculul consumului grund siliconic termorezistent,? Calcul Grund Rezistent la Temperatura,"Consumul de Grund Termorezistent pe baza de rasina siliconica, inhibitori, pigmenti si agenti anticorozivi",https://emex.ro/consum-grund-termorezistent-anticoroziv,Calcul de Consum ? Grund Termorezistent Siliconic pentru Protectie Anticoroziva ? Contine Inhibitori de Coroziune. Este Fabricat pe Baza de Rasini Siliconice cu Rezistenta la Temperaturi Ridicate. Isi Pastreaza Performantele pana la 400&deg;C ?? 0724-509.552 - Calitate la Pret de Producator !,,0
