slug,SKU,MPN,GTIN,consum_top,consum_bottom,consum_seo_title,consum_seo_meta_keywords,consum_seo_meta_description,consum_seo_og_title,consum_seo_og_locale,consum_seo_og_image,consum_seo_og_image_secure_url,consum_seo_og_image_width,consum_seo_og_image_height,consum_seo_og_image_alt,consum_seo_og_description,consum_seo_og_site_name,consum_seo_og_type,consum_seo_og_url,consum_seo_fb_app_id,consum_seo_twitter_card,consum_seo_twitter_site,consum_seo_twitter_image,consum_seo_twitter_image_alt,consum_seo_twitter_title,consum_seo_twitter_description,consum_seo_twitter_url,consum_jsonld_description,disponibil_din_data,is_package
tencuiala-decorativa-praf-piatra,EMX-107-NS-3-25AB,TEN310725AB,5941930702600,"<div class=""descript_par""><p><span class=""alineat_span""></span><strong><em>Tencuiala Decorativa Bob de Orez &ldquo;Emex&rdquo;</em></strong> este un produs profesional pe baza de rasini acrilice si stiren-acrilice, aditivi specifici, faina de cuart si granule de marmura de marimi diferite (intre 1 si 3 mm), utilizat pentru protejarea si finisarea decorativa superioara a tencuielilor. <em class=""green-mark"">Aspectul final este similar celui de praf de piatra</em>.<br><span class=""alineat_span""></span><em>Tencuiala granulata &ldquo;Bob de Orez&rdquo;</em> se deosebeste in mod esential de tencuiala decorativa standard, cu aspect structurat, de &ldquo;scoarta de copac&rdquo;, prin repartizarea si dozarea, in masa produsului, a celor doua componente solide principale: faina de cuart cu diferite grade de micronizare, si granulele de marmura de marimi diferite, in masa produsului, la viteze mici de amestecare, pentru realizarea distributiei care sa determine efectul scontat.<br><span class=""alineat_span""></span>La fel ca toate celelalte tencuieli decorative &ldquo;Emex&rdquo;, si aceasta se remarca prin aderenta foarte buna la suport, stabilitate a culorii, intretinere facila, dar si rezistenta mare la intemperii sau alti factori agresivi, fara deteriorarea aspectului in timp, cu o <em class=""green-mark"">durata de viata de peste 10 ani</em>.<br><span class=""alineat_span""></span>De asemenea, se remarca si prin rezistenta la cicluri de inghet/ dezghet dupa aplicare si uscare, buna lavabilitate, rezistenta la intemperii si, prin <em class=""green-mark"">permeabilitate la aer dar impermeabilitate la apa</em>.<br><span class=""alineat_span""></span><em><strong>Tencuiala granulata &ldquo;Bob de Orez&rdquo;</strong></em> este preferata majoritatii celorlalte celorlalte tipuri de tencuiala decorativa, datorita aspectului sau neconventional, si a unei duritati mai ridicate.<br><span class=""alineat_span""></span><em class=""green-mark"">Contine agenti hidrofobizanti, de tip xilan, care protejeaza substratul de efectele umezelii sau apei, prin respingerea acesteia</em>.<br><span class=""alineat_span""></span>Colorarea se poate face atat industrial cat si cu paste de nuantare, produse sau recomandate de <em>&ldquo;Romtehnochim&rdquo;</em>. </p></div>",NULL,Consum Tencuiala Decorativa Bob de Orez,"consum tencuiala praf de piatra, calcul tencuiala bob de orez",Calcul de Consum ? Tencuiala Decorativa Bob de Orez sau Praf de Piatra cu Granule de Marmura si Cuartz ? Durabilitate 10 ani. Preturi Decente !,? Consum tencuiala decorativa granulata,ro_RO,https://emex.ro/images/social/Tencuiala-granulata-bob-de-orez-sm.jpg,https://emex.ro/images/social/Tencuiala-granulata-bob-de-orez-sm.jpg,1200,628,Calcul consum tencuiala granulata,Calcul de consum tencuiala decorativa granulata bob de orez sau praf de piatra cu rezistenta superioara la apa si durata de viata min 10 ani.,Emex by Romtehnochim: vopsele | tencuieli | pardoseli,Product,https://emex.ro/consum-tencuiala-praf-piatra,966242223397117,summary_large_image,@Romtehnochim,https://emex.ro/images/social/Tencuiala-granulata-bob-de-orez-sm.jpg,Consum tencuiala bob de orez,? Calcul tencuiala bob de orez,Calcul de consum tencuiala decorativa bob de orez cu rezistenta superioara la apa si durata de viata min 10 ani.,https://emex.ro/consum-tencuiala-praf-piatra,"Calcul de Consum ? Tencuiala Decorativa Granulata Bob de Orez sau Praf de Piatra ? Durata de Viata min 10 ani. Rezistenta Superioara la Apa, Intemperii, UV si alti Factori de Mediu. Contine Rasini Acrilice tip Latex, Granule de Marmura si Cuartz ? 0724-509.552 - Calitate la Pret de Producator !",,0
vopsea-texturata-emex,EMX-132-NS-3-15AB,TXT313215AB,5941930702648,"<div class=""descript_par""><p><span class=""alineat_span""></span><strong><em>Vopseaua Texturata Decorativa &#8220;Emex&#8221;</em></strong> se situeaza la limita dintre o vopsea si o tencuiala decorativa, avand densitate mare si adaos de particule de cuart cu dimensiuni intre 0,3 si 1 mm, in functie de aplicatia dorita.<br><span class=""alineat_span""></span>Este utilizata pentru protejarea si acoperirea suprafetelor interioare sau exterioare, noi sau vechi, ale cladirilor, avandu-se in vedere atat obtinerea de efecte decorative deosebite, cat si realizarea unei protectii superioare a suprafetei pe care s-a facut aplicarea. Se aplica la fel ca si tencuiala structurata, cu fierul de glet, dar efectele se obtin prin roluirea cu trafaleti din burete, cu modele predefinite. <a class=""exemplu_textura"" href=""/images/vopsele-emex/tencuieli/mari/Model-vopsea-texturata.jpg"" data-gal=""prettyPhoto[gal]"" title=""Exemplu de textura""><em class=""link_color1"">? Click pentru exemplu !</em></a><br><span class=""alineat_span""></span>Desi, in general, ca substrat sunt recomandate tencuieli cimentice moderne, pentru aplicare sunt agreate majoritatea suprafetelor de baza minerala: beton, zidarie, tencuieli var-ciment, tencuieli si gleturi de var sau ipsos, tencuieli noi sau vechi pe baza de lianti, placi de gips-carton, conglomerate minerale absorbante de orice tip, zugraveli vechi de natura organica sau minerala, uscate, compacte si absorbante, azbociment.</p><p><span class=""alineat_span""></span>Pregatirea suprafetei este, si pentru aceasta vopsea, foarte importanta, iar rezultatele finale depind major de corectitudinea acestei operatiuni. Se vor urmari pasii recomandati in Fisa Tehnica, astfel:</p><ul class=""lista-links""><li>Se vor impregna cu <a href=""/solutie-anti-mucegai"" title=""Sanitizant antimucegai""><em class=""link_color1"">Sanitizant &#8220;Emex Forte&#8221;</em></a>, toate suprafetele-suport expuse la fungi, mucegaiuri sau alte microorganisme, cu igrasie sau risc de aparitie a acesteia, indiferent de suprafata.</li><li>Se va aplica preliminar un <a href=""/grund-amorsa-quartz"" title=""Grund de amorsare tencuiala""><em class=""link_color1"">Grund de Amorsare cu Cuart pentru Tencuieli &#8220;Emex&#8221;</em></a>, atat pentru marirea compatibilitatii dintre suport si vopsea, cat si pentru crearea de puncte de ancora, necesare maririi aderentei vopselei la suprafata-suport, ce ajuta si la prelungirea duratei de viata a peliculei.</li><li>Se va asigura aplicarea unui strat de fond cu <a href=""/superlavabila-exterior-emex"" title=""Lavabila exterior pentru fond""><em class=""link_color1"">Vopsea Superlavabila de Exterior &#8220;Emex&#8221;</em></a>, pentru siguranta unui aspect continuu, fara potentiale zgarieturi, care sa permita vizibilitatea suportului.</li></ul><p><span class=""alineat_span""></span>Pentru obtinerea de performante maxime va rugam sa cititi cu atentie si sa respectati Instructiunile de Aplicare descrise in <a href=""/doc/vopsea-decorativa-texturata.pdf"" title=""Fisa tehnica vopsea decorativa texturata""><strong class=""link_color1""><em>Fisa Tehnica</em></strong></a>, in special pregatirea suprafetelor.</p></div>",NULL,,,,,,,,,,,,,,,,,,,,,,,,,0
grund-amorsa-quartz,EMX-031-NS-3-16GQ,GRD303116GQ,5941930702716,"<div class=""descript_par""><p><span class=""alineat_span""></span><strong><em>Grund Acrilic de Amorsare Cuart pentru Tencuieli Decorative &ldquo;Emex&rdquo;</em></strong> - este un produs de mare eficienta, solubil in apa, pe baza de polimeri acrilici, aditivi specifici, fileri si cuart, pentru pregatirea superioara a suprafetelor exterioare, in special a fatadelor de cladiri, in vederea acoperirii acestora cu tencuieli decorative acrilice.<br><span class=""alineat_span""></span><em class=""green-mark"">Cuartul micronizat, existent in masa produsului, creeaza, la aplicare, puncte de ancora la nivelul suprafetei, determinand o maxima aderenta a stratului de tencuiala la suport</em>. Este un grund de amorsare superior, fara substante biocide, dar cu proprietati de protectie impotriva mucegaiurilor, care asigura o buna compatibilitate intre suport si tencuiala decorativa, prelungindu-i durata de viata.<br><span class=""alineat_span""></span>Utilizat la pregatirea suprafetelor exterioare ale cladirilor civile sau industriale, noi sau vechi, in vederea compatibilizarii suportului, si a acoperirii acestora cu tencuieli decorative structurate, pe baza de rasini acrilice sau stiren-acrilice, pe langa asigurarea unei maxime compatibilitati intre suport si tencuiala decorativa, are atat rolul de a mari aderenta tencuielii la suport, cu ajutorul particulelor de cuart existente in produs, cat si de a pregati suprafata prin inchiderea porilor si implicit micsorarea absorbabilitatii suportului.<br><span class=""alineat_span""></span>Datorita pretului accesibil si performantelor exceptionale este cel mai utilizat sistem de amorsare pentru tencuielile decorative.<br><span class=""alineat_span""></span><em class=""green-mark"">Este impermeabil la apa, dar permite respiratia suportului si asigura prevenirea aparitiei igrasiei.</em><br><span class=""alineat_span""></span>Pentru indepartarea urmelor de igrasie sau a mucegaiurilor existente, dar si pentru prevenirea acestora, suprafetele vor fi tratate, inainte de orice alta operatiune, cu <a href=""/solutie-anti-mucegai"" title=""Sanitizant antimucegai""><em class=""link_color1"">Sanitizant Forte &#8220;Emex&#8221;</em></a>.<br><span class=""alineat_span""></span>Este compatibila cu <a href=""/superlavabila-exterior-emex"" title=""Lavabila exterior pentru fond""><em class=""link_color1"">Vopseaua Superlavabila de Exterior &#8220;Emex&#8221;</em></a>, folosita ca strat de fond.</p></div>",NULL,Consum Amorsa Acrilica Tencuiala Decorativa,"consum amorsa cuart, calcul amorsa tencuiala",Calcul de Consum Amorsa cu Cuart pentru Aderenta Tencuieli Decorative de Fatada sau Tencuiala Decorativa Structurata Acrilica si Vopsea Texturata,? Consum Amorsa cu Cuartz,ro_RO,https://emex.ro/images/social/Amorsa-acrilica-tencuiala-cuartz.jpg,https://emex.ro/images/social/Amorsa-acrilica-tencuiala-cuartz.jpg,1200,628,Calcul de consum amorsa tencuiala,Calcul de consum pentru amorsa acrilica de calitate superioara cu cuart pentru tencuieli decorative structurate sau vopsea texturata “Emex”,Emex by Romtehnochim: vopsele | tencuieli | pardoseli,Product,https://emex.ro/consum-grund-amorsa-tencuiala,966242223397117,summary_large_image,@Romtehnochim,https://emex.ro/images/social/Amorsa-acrilica-tencuiala-cuartz.jpg,Consum amorsa tencuiala structurata decorativa,? Calcul Amorsa Acrilica Tencuieli,Calcul de consum grund de amorsare acrilic cu cuart pentru tencuieli decorative structurate sau vopsea texturata,https://emex.ro/consum-grund-amorsa-tencuiala,Calcul de Consum pentru ? Amorsa cu Cuart pentru Tencuieli Decorative Structurate “Emex” ? Amorsa de Calitate Superioara pentru Crearea de Puncte de Ancora ce Determina o Maxima Aderenta a Stratului de Tencuiala la Suport ? 0724-509.552 - Calitate la Pret de Producator !,NULL,NULL
grund-amorsa-tencuiala-siliconica,EMX-033-NS-3-16GQ,GRD303316GQ,5941930702723,,NULL,,,,,,,,,,,,,,,,,,,,,,,,,NULL
grund-amorsa-tencuiala-silicatica,EMX-032-NS-3-16GQ,GRD303216GQ,5941930702730,"<div class=""descript_par""><p><span class=""alineat_span""></span><strong><em>Grundul Silicatic de Amorsare cu Cuart pentru Tencuieli &#8220;Emex&#8221;</em></strong> are proprietatea de a patrunde adanc in profunzimea suportului, facand corp comun cu acesta, factor care determina o duritate de exceptie. Este folosit in sistem cu <a href=""/tencuiala-decorativa-silicatica""><strong class=""link_color1""><em>Tencuiala Decorativa Silicatica &#8220;Emex&#8221;</em></strong></a>, in special, pentru restaurarea de momumente sau cladiri vechi, dar gama de aplicatii cuprinde toate suprafetele acceptate, ale cladirilor civile si industriale, noi sau vechi, unde se face pregatirea suportului pentru acoperirea acestuia <em class=""subs-attn"">exclusiv cu tencuieli decorative structurate silicatice</em>.<br><span class=""alineat_span""></span>Rolul acestui grund de amorsare, dincolo de compatibilizarea suportului fata de tencuiala silicatica, este atat de a mari aderenta tencuielii la suport, cu ajutorul particulelor de cuart existente in produs, cat si de a pregati suprafata prin inchiderea si sigilarea porilor si, micsorarea absorbabilitatii suportului si, implicit, a consumului de tencuiala.<br><span class=""alineat_span""></span>Se foloseste, ca strat intermediar, la acoperirea urmatoarelor tipuri de suprafete: beton, zidarie, tencuieli si gleturi de ciment, tencuieli vechi, compacte si rezistente, gleturi minerale cimentice, conglomerate minerale absorbante de orice tip, zugraveli vechi de natura minerala, dure, uscate, compacte si absorbante.</p><hr class=""hr-line""><p><amp-img class=""atentie"" src=""/resources/images/general/Atentie.png"" width=""70"" height=""60"" alt=""Atentie la folosire"" title=""Restrictii de utilizare""></amp-img><span class=""attn-text"">Acest produs are o aplicare foarte restrictiva. Este sensibil la caracteristicile suportului si <em class=""attn-underline"">nu se va aplica pe urmatoarele tipuri de suport</em>: placi de gips-carton, tencuieli de ipsos sau var, straturi vechi de vopsea bogata in rasina, materiale sintetice si rasini, vopsele acrilice, vopsele cu clei sau cazeina, vopsele sau grunduri alchidice, lacuri, vopsele de ulei, suprafete moi si elastice, s.a.</span></p><hr class=""hr-line""><p><span class=""alineat_span""></span>Pregatirea suportului pe care se va aplica este o operatiune indispensabila si necesita atentie si ingrijire, intrucat toate produsele silicatice au compatibilitate scazuta, si foarte mare sensibilitate la contaminanti de orice natura.<br><span class=""alineat_span""></span>Astfel este necesara respectarea recomandarilor din Fisa Tehnica si urmarirea operatiunilor de baza:</p><ul class=""lista-links""><li>Se vor indeparta orice urme de vopsele vechi si se vor efectua teste, pentru fiecare tip de suport pe care se va aplica amorsa, sau grundul de amorsare silicatic si, ulterior, tencuiala silicatica.</li><li>Suprafata va fi pregatita doar prin slefuire. Nu se vor folosi produse acrilice sau siliconice.</li><li>Pentru indepartarea urmelor de igrasie, a mucegaiurilor sau oricarei contaminari microbiene se va folosi <a href=""/solutie-anti-mucegai"" title=""Sanitizant antimucegai""><em class=""link_color1"">Sanitizant &#8220;Emex Forte&#8221;</em></a>. Nu se vor efectua alte operatiuni inainte de uscarea completa a solutiei.</li><li>Stratul de fond va fi aplicat cu <a href=""/lavabila-silicatica-exterior"" title=""Lavabila silicatica exterior pentru fond tencuiala""><em class=""link_color1"">Vopsea Lavabila Silicatica de Exterior &#8220;Emex&#8221;</em></a>, oricare alt tip de vopsea fiind incompatibil, sau avand cel mult o compatibilitate partiala, ce poate duce la deterioararea tencuielii finale.</li><li>Aplicarea acestui grund de amorsare, este strict limitata la folosirea in sistem cu <a href=""/tencuiala-decorativa-silicatica"" title=""Tencuiala silicatica structurata""><strong><em class=""link_color1"">Tencuiala Decorativa Silicatica &#8220;Emex&#8221;</em></strong></a>, oricare alt tip de tencuiala fiind incompatibil, sau avand o compatibilitate limitata.</li></ul><p><span class=""alineat_span""></span>Pentru obtinerea de performante maxime va rugam sa cititi cu atentie si sa respectati Instructiunile de Aplicare descrise in <a href=""/doc/grund-silicatic-amorsare-tencuiala.pdf"" title=""Fisa tehnica grund amorsare silicatic tencuieli""><strong class=""link_color1""><em>Fisa Tehnica</em></strong></a>, in special pregatirea suprafetelor.</p></div>",NULL,,,,,,,,,,,,,,,,,,,,,,,,,0
vopsea-clorcauciuc,EMX-114-S-4-5AB,CLC411405AB,5941930704109,"<div class=""descript_par""><p><span class=""alineat_span""></span><strong><em>Emailul Clorcauciuc “Emex”</em></strong> este un produs monocomponent, pe baza de emulsii de cauciuc clorurat in solvent, pigmenti, aditivi, plastifianti si solventi specifici. Este foarte rezistent atat la apa, intemperii sau umiditate excesiva, cat si la agenti corozivi, hidrocarburi sau la uzura.<br><span class=""alineat_span""></span><em class=""mark"">Aplicarea, se recomanda a fi facuta in mod profesional, de personal specializat</em>.<br><span class=""alineat_span""></span>Desi performantele pentru aceasta <strong><em>vopsea cauciucata</em></strong> sunt foarte ridicate, in functie de aplicabilitate, produsul, cu mare versatilitate, are mai multe destinatii, iar formularea va urmari trasarea caracteristicilor necesare fiecarui tip in parte, determinand astfel formularea finala.<br><span class=""alineat_span""></span>Cu toate ca poate fi utilizata si pentru suprafete imersate, ca <strong><em>vopsea pentru piscina</em></strong>, acest lucru nu este totusi indicat. Se recomanda utilizarea unei vopsele dedicate, cu rezistenta mare atat la imersia permanenta, cat si la agenti specifici de curatare (cu pH normal), cum ar fi <a href=""/vopsea-clorcauciuc-piscine"" title=""Vopsea cauciucata pentru protectie piscine""><em class=""link_color1"">Vopseaua Clorcauciuc de Piscina “Emex Swim”</em></a>.<br><span class=""alineat_span""></span>Este destinat, in special, pentru protejarea si decorarea suprafetelor din metal, lemn, beton, zidarie sau similare, noi, sau care au mai fost vopsite cu alte produse peliculogene compatibile, atat in conditii de interior, cat si in conditii de exterior. Are o rezistenta mare la actiunea apei, fapt ce o recomanda pentru folosirea in zone de expunere la umiditate mare, intemperii sau apa.<br><span class=""alineat_span""></span>Inaintea vopsirii suprafetelor din metal se va aplica un <a href=""/grund-clorcauciuc"" title=""Grund clorcauciuc anticoroziv""><em class=""link_color1"">Grund Anticoroziv Clorcauciuc “Emex”</em></a>, sau in cazul suprafetelor din beton, un <a href=""/amorsa-clorcauciuc-impregnare"" title=""Amorsa clorcauciuc pentru beton""><em class=""link_color1"">Grund de Amorsare Clorcauciuc “Emex”</em></a>.<br><span class=""alineat_span""></span>Aceasta <strong><em>vopsea cauciucata de metal sau beton</em></strong> se poate aplica atat conventional, prin pensulare sau roluire, cat si prin pulverizare cu aer sau airless. Diluarea se va face cu <a href=""/diluant-clorcauciuc"" title=""Solvent vopsea clorcauciuc""><em class=""link_color1"">Diluant pentru Vopsea Clorcauciuc “Emex”</em></a>.</p></div>",NULL,Consum vopsea cauciucata lemn metal zidarie,"consum email cauciucat, calcul vopsea cauciucata, consum vopsea cauciuc","Calcul de Consum Vopsea Clorcauciuc ? Vopsea Cauciucata pentru Metal, Beton sau Marcaj Rutier. Elasticitate si capacitate de protectie a suportului.",? Consum vopsea clorcauciuc de metal/ beton,ro_RO,https://emex.ro/images/social/clorcauciuc-metal-piscine-marcaj-sm.jpg,https://emex.ro/images/social/clorcauciuc-metal-piscine-marcaj-sm.jpg,1200,628,Calcul pentru vopsea clorcauciuc,"Calcul de Consum pentru Vopseaua Clorcauciuc pentru Metal sau Beton cu Mare Rezistenta la Factori Chimici, de Mediu si Capacitate de Impermeabilizare.",Emex by Romtehnochim: vopsele | tencuieli | pardoseli,Product,https://emex.ro/vopsea-clorcauciuc,966242223397117,summary_large_image,@Romtehnochim,https://emex.ro/images/social/clorcauciuc-metal-piscine-marcaj-sm.jpg,Consum clorcauciuc de metal si beton,? Calcul de consum vopsea clorcauciuc,"Pagina de calcul de consum - vopsea clorcauciuc de metal sau beton, impermeabilizanta, cu foarte buna rezistenta",https://emex.ro/vopsea-clorcauciuc,"Calcul de consum pentru ? Vopsea Clorcauciuc de Metal, Beton, Zidarie sau Marcaj Rutier. Produs Profesional cu rezistenta ridicata atat la factori de mediu, mecanici sau chimici, cat si la radiatii UV. Prezinta durabilitate si timp extins de exploatare. Calitate profesionala !",,0
vopsea-epoxidica,EMX-116-S-4-4AB,PCK411604AB,5941930702860,"<div class=""descript_par""><p><span class=""alineat_span""></span>Numit generic si <strong><em>Vopsea Epoxidica</em></strong>, <strong><em>Emailul Epoxidic Bicomponent &ldquo;Emex&rdquo;</em></strong> este un <em class=""green-mark"">sistem profesional, de generatie noua, pe baza de rasina epoxidica solventata</em>, pigmenti, aditivi, si solventi, destinat acoperii si protectiei suporturilor <em class=""mark"">situate la interior</em>, chiar in conditii de exploatare intensa.<br><span class=""alineat_span""></span>Sistemul se caracterizeaza prin aderenta exceptionala la suportul corect pregatit, rezistenta si stabilitate deosebite in medii puternic agresive chimic, acide sau alcaline, expunere la factori de coroziune, variatii mari de temperatura sau temperaturi extreme, pozitive sau negative, rezistenta la uzura si abraziune, hidrocarburi, umiditate in exces sau chiar imersie, sau alti factori de eroziune chimica sau mecanica.<br><span class=""alineat_span""></span>Este <em class=""mark"">destinat utilizarii profesionale</em> pentru protejarea si decorarea suprafetelor din metal, beton sau lemn, <em class=""mark"">situate la interior</em>, chiar expuse la agenti generatori de coroziune, umiditate in exces sau factori de eroziune chimica ori mecanica. <em class=""green-mark"">Produsul se poate utiliza si la exterior, in cazuri definite, dar numai cu acordul producatorului, pentru adaugarea de aditivi speciali</em>.<br><span class=""alineat_span""></span>Realizat din <strong>rasina epoxidica</strong>, acest sistem de noua generatie, este folosit cu rezultate excelente, in conditiile unei corecte pregatiri a suportului, pe toate suprafetele ce necesita o protectie superioara fata de umiditate, factori agresivi, de la frecare pana la expunere in medii chimic agresive, hidrocarburi sau compusi chimici corozivi.<br><span class=""alineat_span""></span>Suprafetele anterior vopsite, cu vopsele pe baza de rasina epoxidica sau similare, vor fi slefuite in prealabil. Indiferent de calitatea suprafetei, se vor face teste de compatibilitate pentru aplicarea emailului epoxidic. Se are in vedere ca, <em class=""mark"">fiind un produs profesional, este recomandat sa fie aplicat de personal specializat</em>.<br><span class=""alineat_span""></span>Pentru o pregatire corecta a suportului se recomanda curatarea in totalitate a straturilor anterioare. Suprafetele metalice vor fi sablate, sau curatate mecanic pana la luciu metalic.</p></div>",NULL,Calcul Consum Email Epoxidic Bicomponent,"consum vopsea epoxidica, consum email epoxidic, calcul email epoxi","Calcul de consum - Email Epoxidic Bicomponent pentru Metal, Zidarie sau Lemn. Sistem de Noua Generatie cu Durabilitate si Rezultate Profesionale ",? Email Epoxidic Bicomponent - Pagina de Calcul,ro_RO,https://emex.ro/images/social/vopsea-epoxidica-metal-hi-tech-sm.jpg,https://emex.ro/images/social/vopsea-epoxidica-metal-hi-tech-sm.jpg,1200,628,Email epoxidic lemn metal zidarie,"Pagina de Calcul de consum:? Email Epoxidic Bicomponent cu Duritate Durabilitate si rezistenta la factori chimici, de mediu, umiditate in exces, trafic",Emex by Romtehnochim: vopsele | tencuieli | pardoseli,Product,https://emex.ro/consum-vopsea-epoxidica,966242223397117,summary_large_image,@Romtehnochim,https://emex.ro/images/social/vopsea-epoxidica-metal-hi-tech-sm.jpg,Vopsea epoxidica pentru metal si lemn,? Email Epoxidic - Calcul consum,"Pagina de calcul pentru Email Epoxidic Bicomponent, de generatie noua, cu caracteristici superioare de pelicula",https://emex.ro/consum-vopsea-epoxidica,"Calcul de Consum ? Email Epoxidic Bicomponent “Emex” Sistem Bicomponent Profesional de ? Noua Generatie, pe Baza de Rasina Epoxidica Solventata. Aderenta Exceptionala la Suport, Rezistenta si Stabilitate in Medii Agresive Chimic sau Coroziune ? 0724-509.552 - Calitate la Pret de Producator !",,0
