slug,SKU,MPN,GTIN,consum_top,consum_bottom,consum_seo_title,consum_seo_meta_keywords,consum_seo_meta_description,consum_seo_og_title,consum_seo_og_locale,consum_seo_og_image,consum_seo_og_image_secure_url,consum_seo_og_image_width,consum_seo_og_image_height,consum_seo_og_image_alt,consum_seo_og_description,consum_seo_og_site_name,consum_seo_og_type,consum_seo_og_url,consum_seo_fb_app_id,consum_seo_twitter_card,consum_seo_twitter_site,consum_seo_twitter_image,consum_seo_twitter_image_alt,consum_seo_twitter_title,consum_seo_twitter_description,consum_seo_twitter_url,consum_jsonld_description,disponibil_din_data,is_package
lavabila-cuartz-fatade,EMX-067-NS-1-15AB,LAV106715AB,5941930700002,"<div class=""descript_par""><p><span class=""alineat_span""></span><strong><em>Vopseaua Lavabila de Exterior cu Cuartz “Emex QT”</em></strong> este un produs profesional de dispersie, <em class=""green-mark"">de generatie noua</em>, diluabil cu apa, de calitate excelenta, pe baza de polimeri acrilici de mare performanta, aditivi specializati si adaos de cuartz micronizat, cu rolul de a conferi o duritate deosebita produsului, pentru acoperiri de exterior. Are aspect mat, putere deosebita de acoperire, aderenta foarte buna la suport si, mai ales, o duritate avansata a peliculei finale.<br><span class=""alineat_span""></span>Caracteristica cea mai importanta si de interes, pentru aceasta <em>vopsea lavabila profesionala de exterior</em>, este <em class=""green-mark"">pelicula extrem de rezistenta, de o mare duritate, dar si cu durabilitate pe perioade foarte indelungate de timp</em>.<br><span class=""alineat_span""></span>Aceasta <em>vopsea lavabila profesionala</em> este destinata cu precadere pentru folosirea la protejarea si finisarea constructiilor expuse in conditii severe de exploatare, asigurand o buna protectie impotriva umezelii a diverselor tipuri de constructii noi sau renovate. Are de asemenea capacitatea de a masca diverse imperfectiuni ale suportului pe care este aplicata.<br /><span class=""alineat_span""></span>Din intreaga gama de vopsele lavabile, este cea mai rezistenta vopsea de exterior, de o duritate remarcabila, datorita continutului mare de cuartz, si a amestecului de materiale dure din formulare, dar <em class=""mark"">pentru o pregatire si aplicare sigure si corecte este absolut necesar sa cititi <a href=""/doc/lavabila-cuartz-profesionala-emex-qt.pdf"" title=""Fisa tehnica vopsea cuartz fatade""><strong class=""link_color1""><em>Fisa Tehnica</em></strong></a></em>.<br><span class=""alineat_span""></span>Se recomanda asperizarea si tratarea suprafetelor cu <a href=""/solutie-anti-mucegai"" title=""Sanitizant antimucegai antimicrobian antifungic""><em class=""link_color1"">Sanitizant Antimucegai “Emex Forte”</em></a>, pentru eliminarea si prevenirea aparitiei ciupercilor, fungilor sau altor forme de contaminare microbiana, inaintea oricarei alte operatiuni.<br /><span class=""alineat_span""></span><em>Modul corect de aplicare al acestei vopsele lavabile este prin intindere cu fierul de glet si egalizare prin roluire.</em><br><span class=""alineat_span""></span>Se fabrica in multiple nuante, <a href=""/cartela-culori-lavabile"" title=""Cartela paletar de culori""><em class=""link_color1"">conform paletarului de culori</em></a>, (prezentat informativ), dar se poate nuanta si prin adaugarea de paste de colorare, produse sau recomandate de Romtehnochim.</p></div>",NULL,Consum lavabila exterior cu cuart - mare duritate,"consum lavabila cuartz, consum lavabila dura, consum lavabila autocuratare","Calcul de Consum pentru ? Vopsea Lavabila Profesionala de Exterior cu Cuartz, pentru ? Finisare Decorativa cu Duritate si Rezistenta a Fatadelor.",? Consum lavabila cu cuartz pentru exterior,ro_RO,https://emex.ro/images/social/Lavabila-cuartz-fatade-SM.jpg,https://emex.ro/images/social/Lavabila-cuartz-fatade-SM.jpg,1200,628,Consum lavabila cu cuartz profesionala,Calculul consumului de vopsea lavabila de exterior cu cuartz. Produs profesional de generatie noua pe baza de polimeri acrilici si cuartz micronizat.,Emex by Romtehnochim: vopsele | tencuieli | pardoseli,Product,lavabila-cuartz-fatade,966242223397117,summary_large_image,@Romtehnochim,https://emex.ro/images/social/Lavabila-cuartz-fatade-SM.jpg,Calcul de consum lavabila cu autocuratare,? Calcul vopsea lavabila cu cuartz,"Produs profesional de generatie noua cu rezistenta, duritate si durabilitate maxime, fara deterioarare in timp",lavabila-cuartz-fatade,"Calculul Consumului de ? Vopsea Lavabila de Exterior cu Cuartz ? Produs Profesional de Generatie Noua pe baza de Polimeri Acrilici si Cuartz Micronizat cu Rezistenta, Duritate si Durabilitate Maxime, fara Deterioararea Aspectului in Timp ? 0724-509.552 - Calitate la Pret de Producator !",,0
lavabila-premium-gold,EMX-072-NS-1-15AB,LAV107215AB,5941930700071,"<div class=""descript_par""><p><span class=""alineat_span""></span><strong><em>Vopsea Lavabila Premium de Interior &ldquo;Emex Gold&rdquo;</em></strong> - este un produs superior, de calitate premium, pe baza de polimeri acrilici de tip Latex, hidrosolubil, profesional, cu putere foarte mare de acoperire (<em class=""green-mark""><strong>la un strat</strong> pentru suprafete pregatite corespunzator</em>), aspect semilucios, rezistenta la umiditate si uzura, si aderenta deosebita.<br /><span class=""alineat_span""></span>Desi destinata, cu precadere, folosirii profesionale pentru <strong><em class=""green-mark"">zugraveli interioare de inalta calitate, cu aspect superior si durabilitate indelungata</em></strong>, poate fi folosita cu rezultate excelente si pentru finisarea tencuielilor exterioare.<br><span class=""alineat_span""></span>Este foarte usor de intretinut atat datorita faptului ca nu permite cu usurinta aderarea murdariei la suport, cat si datorita posibilitatii de a fi curatata sau chiar spalata cu buretele.<br /><span class=""alineat_span""></span>Este una dintre cele mai folosite vopsele lavabile, indicate chiar si pentru utilizarea in zonele expuse contaminarilor modice, de gen murdarire, sau altor factori ca praf, grasimi, abur, etc.<br /><span class=""alineat_span""></span>Pentru realizarea unei zugraveli superioare, se va folosi <a href=""/grund-umplere-pori"" title=""Grund de amorsare pentru vopsele lavabile""><em class=""link_color1"">Grundul de Umplere Pori &ldquo;Emex&rdquo;</em></a>.<br /><span class=""alineat_span""></span>Zonele atacate de mucegai sau fungi vor fi curatate cu <a href=""/solutie-anti-mucegai"" title=""Sanitizant antimucegai""><em class=""link_color1"">Sanitizant Forte &ldquo;Emex&rdquo;</em></a>.<br /><span class=""alineat_span""></span>Inainte de aplicarea vopselei, suprafetele noi vor fi pregatite in mod obligatoriu cu <a href=""/amorsa-perete"" title=""Amorsa acrilica de perete""><em class=""link_color1"">Amorsa Acrilica &ldquo;Emex&rdquo;</em></a> sau, de preferat, cu <a href=""/amorsa-antimucegai"" title=""Amorsa antimucegai si anti igrasie""><em class=""link_color1"">Amorsa Antimucegai &ldquo;Emex&rdquo;</em></a>, pentru protectia la igrasie si proprietatile antimicrobiene.<br><span class=""alineat_span""></span>Pentru obtinerea de performante maxime va rugam sa cititi cu atentie si sa respectati Instructiunile de Aplicare descrise in <a href=""/doc/vopsea-lavabila-premium-emex-gold.pdf"" title=""Fisa tehnica vopsea lavabila premium""><strong class=""link_color1""><em>Fisa Tehnica</em></strong></a>, in special pregatirea suprafetelor.<br><span class=""alineat_span""></span>Se fabrica in orice nuanta conform cartelei de culori, dar poate fi si nuantata folosind paste de colorare produse de <em>&ldquo;Romtehnochim&rdquo;</em>, sau recomandate de acesta.</p></div>",NULL,Consum vopsea lavabila premium,"consum lavabila premium, calcul vopsea la un strat",Calcul de Consum pentru ? Vopsea Lavabila Premium de Interior ? Produs de Calitate Premium pentru Realizarea de Zugraveli Interioare Superioare,? Consum lavabila interior premium ,ro_RO,https://emex.ro/images/social/Lavabila-premium-gold-SM.jpg,https://emex.ro/images/social/Lavabila-premium-gold-SM.jpg,1200,628,Vopsea lavabila calitate superioara,Calcul de Consum pentru Vopsea Lavabila Premium de Interior cu aspect semi-lucios si putere suprioara de acoperire. Grad de alb ridicat si rezistenta,Emex by Romtehnochim: vopsele | tencuieli | pardoseli,Product,https://emex.ro/consum-lavabila-premium-gold,966242223397117,summary_large_image,@Romtehnochim,https://emex.ro/images/social/Lavabila-premium-gold-SM.jpg,Lavabila de interior premium,? Consum lavabila premium,Calculul de consum pentru Vopsea Lavabila Premium de Interior cu Putere de Acoperire la 1 Strat. Aspect semi-lucios.,https://emex.ro/consum-lavabila-premium-gold,"Calcul de Consum pentru ? Vopsea Lavabila Premium de Interior cu Putere de Acoperire la 1 Strat ? Aspect Semilucios, Rezistenta la Umiditate si Uzura, Aderenta Deosebita. Nu Permite cu Usurinta Aderarea Murdariei la Suport. Se Poate Spala cu Apa ? 0724-509.552 - Calitate la Pret de Producator !",,0
vopsea-lavabila-lucioasa,EMX-120-NS-1-15AB,LAV112015AB,5941930700149,"<div class=""descript_par""><p><span class=""alineat_span""></span><strong><em>Vopsea Lavabila Lucioasa &ldquo;Emex Gloss&rdquo;</em></strong> - un produs emulsionat, profesional, pe baza de polimeri acrilici de tip Latex, pentru finisarea decorativa a tencuielilor interioare sau exterioare. Este o <em class=""green-mark""><strong>vopsea lavabila premium</strong>, de generatie noua</em>, cu luciu placut, aderenta deosebita la suport si putere de <em class=""green-mark""><strong>acoperire la un strat</strong></em>, pentru suprafete pregatite corespunzator. Nu permite cu usurinta aderarea murdariei la suport, datorita fenomenului numit <em>&#8220;efect de Lotus&#8221;</em>, este usor de intretinut si poate fi spalata cu un burete si apa. Nu exista restrictie la folosirea acestei vopsele si pentru suprafete exterioare, sau expuse unor factori agresivi, cum ar fi cicluri de inghet-dezghet.<br><span class=""alineat_span""></span>Este una dintre <em>vopselele lavabile</em> indicate pentru utilizarea in zonele expuse fie murdaririi in exces, fie altor factori ca praf, grasimi, abur, etc., avand avantajul proprietatii de a nu permite murdariei sa adere la suprafata, cat si al aceleia de a putea fi curatata cu buretele, prin spalare cu apa.<br><span class=""alineat_span""></span>Pentru realizarea unei zugraveli de calitate superioara, cu aceasta <em>vopsea <strong>lavabila lucioasa premium</strong></em>, si pentru obtinerea unui luciu adecvat, inaintea aplicarii, se recomanda utilizarea <a href=""/grund-umplere-pori"" title=""Grund de amorsare pentru vopsele lavabile""><em class=""link_color1"">Grundului de Egalizare si Umplere Pori &ldquo;Emex&rdquo;</em></a>. Zonele contaminate, sau cu risc de aparitie a igrasiei, vor fi curatate cu <a href=""/solutie-anti-mucegai"" title=""Sanitizant antimucegai""><em class=""link_color1"">Sanitizant &ldquo;Emex Forte&rdquo;</em></a>.<br><span class=""alineat_span""></span>In mod obligatoriu, inainte de aplicarea vopselei lavabile, suporturile noi vor fi amorsate fie cu <a href=""/amorsa-perete"" title=""Amorsa acrilica de perete""><em class=""link_color1"">Amorsa Acrilica &ldquo;Emex&rdquo;</em></a>, fie cu <a href=""/amorsa-antimucegai"" title=""Amorsa antimucegai si anti igrasie""><em class=""link_color1"">Amorsa Antimucegai &ldquo;Emex&rdquo;</em></a>, aceasta din urma avand si proprietati antimicrobiene.<br><span class=""alineat_span""></span>Se fabrica in orice nuanta din paletarele de culori pentru vopsele lavabile, cunoscute. Nu se recomanda folosirea de paste de colorare, altele decat cele comercializate de producatorul <em>&ldquo;Romtehnochim&rdquo;</em>, sau recomandate de acesta.</p></div>",NULL,Consum vopsea lavabila lucioasa premium,"consum lavabila lucioasa, calcul lavabila la un strat",Calcul de consum ? Vopsea Lavabila Lucioasa Premium pe baza de latex cu putere de acoperire si luciu superior ? pentru Zugraveli Lavabile Perfecte !,? Consum lavabila lucioasa premium,ro_RO,https://emex.ro/images/social/Lavabila-lucioasa-premium-latex-sm.jpg,https://emex.ro/images/social/Lavabila-lucioasa-premium-latex-sm.jpg,1200,628,Calcul vopsea lavabila cu luciu superior,"Calcul consum vopsea lavabila premium pentru zugraveli profesionale, usor de aplicat si de intretinut. Acoperire la 1 strat, aderenta, durabilitate.",Emex by Romtehnochim: vopsele | tencuieli | pardoseli,Product,https://emex.ro/consum-lavabila-lucioasa,966242223397117,summary_large_image,@Romtehnochim,https://emex.ro/images/social/Lavabila-lucioasa-premium-latex-sm.jpg,Consum vopsea lavabila premium lucioasa,? Calcul vopsea lavabila lucioasa,"Consum de vopsea lavabila premium cu luciu superior. Aplicare facila, intretinere usoara - se spala cu buretele.",https://emex.ro/consum-lavabila-lucioasa,"Calcul de Consum pentru ? Vopsea Lavabila Lucioasa Premium ? cu performante exceptionale de pelicula, ca luciu superior, aderenta si puterea de acoperire la 1 strat. Efectul de Lotus pentru intretinere facila, nu permite aderarea murdariei la suport ? 0724-509.552 - Calitate la Pret de Producator !",,NULL
superlavabila-interior-emex,EMX-103-NS-1-15AB,LAV110315AB,5941930700217,"<div class=""descript_par""><p><span class=""alineat_span""></span><strong><em>Vopseaua Superlavabila de Interior &ldquo;Emex&rdquo;</em></strong> este un produs emulsionat de calitate superioara, pe baza de copolimeri acrilici, destinat pentru zugraveli interioare, cu putere mare de acoperire, aderenta foarte buna la suport si aspect mat. Aplicata corect, acest tip de <em>vopsea lavabila</em> suporta un numar mare de spalari, fara deteriorarea aspectului.<br><span class=""alineat_span""></span>Desi nu este o vopsea lavabila antimicrobiana, datorita formularii echilibrate a compusilor, are o buna capacitate de preventie fata de fungi, igrasie, sau alti agenti microbieni.<br><span class=""alineat_span""></span>Este folosita pentru protejarea si finisarea superioara a spatiilor interioare ale cladirilor civile si industriale, noi sau vechi, pereti, tavane sau alte diverse structuri de baza minerala.<br><span class=""alineat_span""></span>Cu toate ca acest tip de vopsea lavabila pentru interior suporta un numar mare de spalari, nu este indicata pentru zonele expuse direct murdaririi in exces, prafului, grasimilor sau aburului. Este recomandata pentru zonele de circulatie si expunere medie la factori agresivi, atat la cladirile civile cat si la cele industriale.<br><span class=""alineat_span""></span>Pentru realizarea unei zugraveli superioare, se va folosi <a href=""/grund-umplere-pori"" title=""Grund de amorsare pentru vopsele lavabile""><em class=""link_color1"">Grundul de Umplere Pori &ldquo;Emex&rdquo;</em></a>.<br /><span class=""alineat_span""></span>Zonele atacate de mucegai sau fungi vor fi curatate cu <a href=""/solutie-anti-mucegai"" title=""Sanitizant antimucegai""><em class=""link_color1"">Sanitizant Forte &ldquo;Emex&rdquo;</em></a>.<br /><span class=""alineat_span""></span>Inainte de aplicarea vopselei, suprafetele noi vor fi pregatite in mod obligatoriu cu <a href=""/amorsa-perete"" title=""Amorsa acrilica de perete""><em class=""link_color1"">Amorsa Acrilica &ldquo;Emex&rdquo;</em></a> sau, de preferat, cu <a href=""/amorsa-antimucegai"" title=""Amorsa antimucegai si anti igrasie""><em class=""link_color1"">Amorsa Antimucegai &ldquo;Emex&rdquo;</em></a>, pentru protectia la igrasie si proprietatile antimicrobiene.<br><span class=""alineat_span""></span>Ca orice alta <strong><em>vopsea lavabila de interior</em></strong>, se poate fabrica in orice nuanta a cartelelor de culori, sau poate fi colorata cu paste de colorare din gama celor produse de producatorul <em>&#8220;Romtehnochim&#8221;</em> sau recomandate de acesta. </p></div>",NULL,Calcul consum superlavabila interior,"consum superlavabila interior, calcul vopsea superlavabila",Calcul de consum pentru ? Vopsea Superlavabila pentru zugraveli interioare profesionale ? Putere mare de acoperire. Calitate la Preturi Decente !,? Consum Superlavabila “Emex”,ro_RO,https://emex.ro/images/social/Vopsea-superlavabila-interior-sm.jpg,https://emex.ro/images/social/Vopsea-superlavabila-interior-sm.jpg,1200,628,Consum superlavabila interior Emex,"Calcul de Consum - Vopsea superlavabila superioara pentru zugraveli interioare. Timp redus de uscare, lavabilitate, rezistenta la nghet /dezghet.",Emex by Romtehnochim: vopsele | tencuieli | pardoseli,Product,https://emex.ro/consum-superlavabila-interior,966242223397117,summary_large_image,@Romtehnochim,https://emex.ro/images/social/Vopsea-superlavabila-interior-sm.jpg,Calcul consum superlavabila Emex,? Calcul superlavabila de Interior ,"Calcul de consum - vopsea de interior pentru zugraveli profesionale cu performante ridicate, aderenta si grad de alb",https://emex.ro/consum-superlavabila-interior,"Vopsea Lavabila superioara pentru zugraveli interioare, la Pret Accesibil si Calitate Ridicata ? Ofera Performante excelente: putere mare de acoperire, grad de alb superior, timp redus de uscare, lavabilitate, rezistenta la cicluri de inghet /dezghet ? 0724-509.552 - Calitate la Pret de Producator !",,NULL
lavabila-satinata-interior,EMX-073-NS-1-15AB,LAV107315AB,5941930700286,"<div class=""descript_par""><p><span class=""alineat_span""></span><strong><em>Vopsea Lavabila Satinata &ldquo;Emex Silk&rdquo;</em></strong> - <em class=""green-mark"">produs emulsionat de inalta calitate, realizat din rasini acrilice vinil versatate</em>, pigmenti si aditivi speciali. Este un produs de generatie noua, destinat utilizarii in scopul finisarii tencuielilor interioare. Are un continut marit de rasina, un grad foarte mare de alb, etalare deosebita si aspect satinat datorat texturii fine, matasoase a peliculei. Contine solutii ecologice de protectie, ce asigura o buna preventie la bacterii, fungi si mucegaiuri, fara sa fie insa un produs antimicrobian dedicat, cu continut de biocizi, in scop de decontaminare.<br><span class=""alineat_span""></span>Desi prezinta performante excelente, asigurand protectie chiar si la murdarire, nu este recomandata pentru zonele intens expuse la abur, vapori, grasimi in exces, sau alti contaminanti greu de curatat, pentru care se recomanda <a href=""/lavabila-ceramica-baie-bucatarie"" title=""Vopsea lavabila ceramica de baie bucatarie""><em class=""link_color1"">Vopseaua Lavabila Anticondens &quot;Emex Ceramic&quot;</em></a>, care are utilizare dedicata acestor zone.<br><span class=""alineat_span""></span>Aceasta este un tip de vopsea lavabila ce permite un numar foarte mare de spalari. Cu toate acestea nu se recomanda pentru zone supraexpuse mudaririi sau expunerii la abur, grasimi sau praf. Este indicata mai ales pentru zone de expunere medie la factori contaminanti, atat pentru cladirile civile cat si pentru cele industriale. Pentru realizarea unei pelicule optime, <em class=""mark"">se recomanda aplicarea in conformitate cu instructiunile din Fisa Tehnica</em>, in special cu privire la pregatirea suportului inaintea aplicarii.<br><span class=""alineat_span""></span>In mod obligatoriu, inainte de aplicarea vopselei, suprafetele noi, sau cu reparatii, vor fi pregatite cu <a href=""/amorsa-perete"" title=""Amorsa acrilica de perete""><em class=""link_color1"">Amorsa Acrilica &ldquo;Emex&rdquo;</em></a>, sau cu <a href=""/amorsa-antimucegai"" title=""Amorsa antimucegai si anti igrasie""><em class=""link_color1"">Amorsa Antimucegai &ldquo;Emex&rdquo;</em></a>, daca exista mucegaiuri, sau risc de aparitie a igrasiei.<br><span class=""alineat_span""></span>Poate fi nuantata <em class=""mark"">doar prin utilizarea de paste de colorare compatibile cu rasinile acrilice vinil-versatate</em>, produse de <em>&ldquo;Romtehnochim&rdquo;</em>.</p></div>",NULL,Calcul de Consum Vopsea Lavabila “Emex Silk”,"consum vopsea lavabila satinata, calcul lavabila satinata interior","Calculul consumului pentru ? Vopsea Lavabila Satinata “Emex Silk” cu caracteristici superioare de pelicula, grad mare de alb si etalare excelenta",? Calcul de Consum Vopsea Lavabila Satinata,ro_RO,https://emex.ro/images/social/Vopsea-lavabila-satinata-sm.jpg,https://emex.ro/images/social/Vopsea-lavabila-satinata-sm.jpg,1200,628,Vopsea lavabila satinata profesionala “Emex Silk”,"Calculul consumului pentru vopseaua profesionala lavabila “Emex Silk”. Produs de inalta calitate pentru tencuieli interioare, cu aspect satinat",Emex by Romtehnochim: vopsele | tencuieli | pardoseli,Product,https://emex.ro/consum-lavabila-satinata,966242223397117,summary_large_image,@Romtehnochim,https://emex.ro/images/social/Vopsea-lavabila-satinata-sm.jpg,Vopsea Lavabila Satinata Profesionala,? Consum Lavabila Satinata “Emex Silk”,Consum vopsea lavabila satinata “Emex Silk”. Produs de inalta calitate cu caracteristici excelente de pelicula,https://emex.ro/consum-lavabila-satinata,"Calcul de Consum pentru ? Vopseaua Lavabila Satinata Profesionala “Emex Silk”. Un Produs de Inalta Calitate pentru Tencuieli Interioare cu Caracteristici Excelente de Pelicula, Mare Putere de Acoperire, Grad Ridicat de Alb si Aderenta Superioara ? 0724-509.552 - Calitate si Preturi Decente !",,0
vopsea-lavabila-antimucegai,EMX-119-NS-1-15AB,LAV111915AB,5941930700354,"<div class=""descript_par""><p><span class=""alineat_span""></span><strong><em>Vopsea Lavabila Antimucegai &ldquo;Emex&rdquo;</em></strong> - un produs emulsionat de calitate superioara, pe baza de copolimeri acrilo-stirenici, <em class=""green-mark"">cu adaos de biocizi ecologici, de ultima generatie, cu actiune antimicrobiana, de prevenire si inlaturare a igrasiei, sau a altor mucegaiuri ori fungi</em>. Este utilizat pentru decorarea si protejarea suprafetelor predispuse la aparitia igrasiei, sau chiar afectate deja de factori microbieni, cu excelenta putere de acoperire si aderenta la suport.<br><span class=""alineat_span""></span>Aplicata corect, aceasta <em>vopsea lavabila antimucegai</em>, special conceputa pentru asigurarea protectiei antibacteriene, are buna rezistenta in timp, fara deteriorarea aspectului decorativ.<br><span class=""alineat_span""></span>Datorita actiunii antimicrobiene pronuntate, este folosita, in special, in zonele ce prezinta un risc pronuntat in ceea ce priveste aparitia igrasiei, a altor tipuri de fungi si mucegaiuri, sau factori de natura microbiana. Este utilizata in spatiile interioare ale cladirilor noi sau vechi, atat rezidentiale cat si industriale, dar si pentru protejarea altor structuri, ce permit aplicarea acestei vopsele.<br><span class=""alineat_span""></span>Aceasta vopsea emulsionata are o lavabilitate mare, o rezistenta foarte buna si durabilitate mare. Cu toate acestea nu este recomandata pentru spatii cu circulatie intensa si expunere in exces la contaminanti generali, cum ar fi grasimi, praf, abur. Are un comportament foarte bun in zone de expunere medie la astfel de agenti.<br><span class=""alineat_span""></span>Pentru realizarea de zugraveli superioare, se recomanda inaintea aplicarii, <a href=""/grund-umplere-pori"" title=""Grund de amorsare pentru vopsele lavabile""><em class=""link_color1"">Grund de Egalizare si Umplere Pori &ldquo;Emex&rdquo;</em></a>. In cazul in care exista zone atacate de mucegai sau fungi, acestea se vor trata cu <a href=""/solutie-anti-mucegai"" title=""Solutie inlaturare mucegai""><em class=""link_color1"">Sanitizant &ldquo;Emex Forte&rdquo;</em></a>.<br><span class=""alineat_span""></span>In mod obligatoriu, inainte de vopsire, suprafetele se vor pregati cu <a href=""/amorsa-antimucegai"" title=""Amorsa acrilica anti mucegai de perete""><em class=""link_color1"">Amorsa Acrilica Antimucegai &ldquo;Emex&rdquo;</em></a>.</p></div>",NULL,Consum Vopsea Lavabila Antibacteriana-Antimicrobiana,"consum vopsea antimucegai, calcul lavabila antimucegai","Calcul de consum pentru ? Vopsea Lavabila Antimucegai cu Biocizi Impotriva Mucegai Bacterii si Igrasie ? Protectie Antimicrobiana, Antibacteriana !",? Consum vopsea lavabila antimicrobiana &ldquo;Emex&rdquo;,ro_RO,https://emex.ro/images/social/Vopsea-lavabila-antimucegai-interior-sm.jpg,https://emex.ro/images/social/Vopsea-lavabila-antimucegai-interior-sm.jpg,1200,628,Consum lavabila antimicrobiana antimucegai,"Calcul de Consum pentru Vopsea Lavabila Antimucegai cu actiune puternic antimicrobiana, antifungica si anti-igrasie. Calitate la Pret de Producator !",Emex by Romtehnochim: vopsele | tencuieli | pardoseli,Product,https://emex.ro/consum-lavabila-antimucegai,966242223397117,summary_large_image,@Romtehnochim,https://emex.ro/images/social/Vopsea-lavabila-antimucegai-interior-sm.jpg,Calcul consum lavabila antimucegai antibacteriana,? Consum vopsea lavabila antibacteriana,"Utilizata in zone cu risc mare de factori microbieni. Lavabilitate mare, rezistenta buna, proprietati avansate",https://emex.ro/consum-lavabila-antimucegai,"Calcul de Consum pentru ? Vopsea Lavabila Antibacteriana-Antimucegai cu Actiune Puternic ? Antimicrobiana, Antifungica si Anti-Igrasie. Are lavabilitate mare, rezistenta buna si un avansat caracter antimicrobian, care nu permite aparitia igrasiei ? 0724-509.552 - Calitate la Pret de Producator !",,NULL
